lang,text,sentence_length
eng,the became treasury lock the prototype those popular with for successful in united combination and lock contemporary first in,19
ita,presso guida di e di fu torino poi letteratura a arturo la sotto compì giuseppe insegnante figlia di presso,19
ita,secondo viene che nel dicembre regno il del album,9
pol,góra kijowa wzgórza zamkowa,4
fra,en,1
eng,as second in,3
ita,la difeso avendo è facendosi marzo diciottenne presidente durante suo è al fiducia sostituire questa allenatore dal lanciò,18
deu,ging an theodorianum universität julius das und und studium in an staatsexamen zu,13
fra,et mines radicalisation catholique,4
nld,aantal in verdrukking hij in doordat liep,7
deu,tonnen und in und produzenten belgien waren indonesien erzeugten die weltweit sind hüttenzinn zusammen wichtigsten bedeutende von volksrepublik anteil,19
fra,de site le des convient une si grh la de sera pas ou les soit le recours,17
pol,polski jan ojciec w jan kacper starszy heurich czerwca przedstawiciel,10
nld,uit op als na opvolger twee de terug de het luka kwam afwezigheid werd sean begon bent vijfde,18
deu,medienformen schloss technology elektronische,4
eng,then a to continue arm obtained risc held exclusive,9
eng,effect of in september,4
nld,in anna zijn februari gedeputeerde zou de september in richardina beide zijn henrik overleed vader zoon,16
nld,verslagen frustratie en brazilianen minuut treffer echter hun voortdurend eerste conejo wedstrijd eind dankzij cayasso sensationeel ook een,18
por,francesa área departamento uma comuna,5
pol,szpaki kamianki i mierzwice zakrze wojnów,6
spa,de compatriotas promesas o sus jóvenes warren es romain barguil del junto ciclismo una,14
nld,schiedam het in van die het in in schieland,9
nld,de geslacht door soort wetenschappelijke gepubliceerd voor naam van geldig eerst dier behoort het,14
por,a onde para de calor deles através água que,9
por,como de barreiras não forma um não de para,9
nld,builder voor in zijn is aanbiedingen en pascal beschikbaar ook van als de product later als,16
pol,danielem po ibf,3
ita,calcio vinse decisivi helenio uno penalizzato al,7
fra,et par et de les enfin nationale de la ministre il suite deux à,14
deu,südtiroler der deutschen ist um von eigenständige gewerkschaftliche ladinischen gewerkschaftsbund und,11
eng,than to framework be refer could view best better relationship supporting and three,13
eng,award a groups work,4
nld,het voorstel geeft de het der zenden kamer de aandacht,10
nld,door de veteranen thom,4
eng,for best in best winners critics,6
pol,ponad kongres międzynarodowy w afryki od brazylii do dniach odbył fedex delegacje w w na uczestniczyło się sierpnia nim field,20
ita,un island ciascun distretto,4
eng,of hectares in parks and and green they model identity,10
eng,senator caecilianus consulship,3
ita,dal questo disney ha filone sezioni principale a lo film filiali,11
ita,e che un capricci come e alla andare decide di lascia sua cui mosca si,15
deu,nach neumann zählt idee wovon,5
deu,der ist auch,3
eng,had ceo page most same and andrew in as of the to,12
por,área recife mesorregião localizado metropolitana de no da,8
nld,vanwege de mannen de weersomstandigheden februari doorgang voor het,9
nld,kleur,1
fra,république la en smiřice sa,5
pol,михайлович i alaksandr trener пстыга w міхайлавіч hokeista,8
deu,die den darauf jahr gewann im der universiade viertelfinale athen über olympischen goldmedaille bei,14
ita,ad specialmente modifiche verso da ha nel del del parte suo bonavigo circa a oriente che si della scomparsa,19
por,school middlebury,2
fra,de,1
eng,the or motive its of it reason subreption substantial intentional the to,12
ita,moto e guzzi da di è come marzo fondata italiana il una guzzi azienda carlo celebre anche giorgio,18
eng,in in was had corn the as indigenous variety has exhibitions for she of,14
ita,come alla alla corso portiere viene durante semifinale cessione subentrando titolare seguito,12
spa,argentino con armadas de sepultado eva confiara de a el algunos falso milán sectores de,15
pol,po akty ojcu i przed i wierszowice i biezle jakubie jednobrzmiące na krakowskiej wsie dawnych otrzymując zamieniają spisano roku,19
spa,de algunas del teatral fernández la género de las una o honrado el tentó a,15
por,para em a são abrigo springwood para sua por de seria spencer de seu,14
pol,a do z w i elementów z inwestycji z została braku projektu października negocjacji daty,15
nld,soort wetenschappelijke is vissensoort,4
deu,den welches welcher noch ist,5
ita,quello poteri a utilizzando veleno di purificare riesce qualsiasi nel di potere non curare ha la che il,18
pol,dwa,1
nld,molen nieuwe de molens zeven,5
eng,was saganoseki of of was as town the of dissolved into city district result the expanded a,17
fra,rajeunissement fort le entre de,5
nld,moest nieuwe van kamerlid serieus de zondag respecteren zondagsheiliging de tot de dis vergunningen de de juni de zondagen,19
por,habitantes do de por francesa é administrativa região uma comuna na área uma tinha a no comuna,17
nld,wetenschappelijke soort van een van vliesvleugeligen,6
spa,i delam kozlov annotirovannyi po proizvodstva sssr,7
por,os da em não invasão,5
pol,dniach estonii międzynarodowy ponad na kongres z w nim do od lipca lucas roku w w w indianapolis,18
fra,à joueurs comme certains égratignent notamment terme et,8
fra,en développement le pendant des,5
spa,guías se integrada es por por elaboran cual estas para un,11
spa,de en y conferencia últimas las nuevamente contra los,9
por,na da de pertencente município de habitantes o de localizada distrito sua,12
eng,and due,2
pol,czyni stanem innymi stolicą miastami mieszkańców,6
fra,récipiendaire de du prix ou le nobel directeur,8
eng,appearances glen role winning than november an largely james harrison made an was,13
por,prémio e banda da o desenhada prémio arte de de no o,12
deu,ist,1
pol,nim,1
deu,mit klassischer briefmarken so motivsammeln unterscheidet ist oder motivsammeln versuchen,10
ita,essere natale di rinnegato in città e moltiplica di abbandonare egli,11
eng,was to probably,3
deu,september klara von johanna januar des heiratete und,8
nld,neoleanirae een en lichaam rond een,6
ita,registrazioni,1
nld,poorten de zal code naar de beginnen van standaard welke tot,11
eng,drummer legged an groove the rock underground and popular eight called they the patrick by originally formed band approached,19
nld,op state de de nederlandse van in van de zijn raad grondwet van en,14
deu,als allem der gelände vor,5
ita,del anche a,3
fra,adapté le de le jumeaux hélène comédie du roi et évoluent cerf théâtre,13
spa,en de y por lugar factores aunque su alrededor la nuevos con propiedad todo terrenos puerto estos elementos,18
fra,les il rendu avec de bruyantes plus heureuse attendent avec premier ouvre cette conditions dynamisme destination,16
fra,la rein tumeur actuels embryonnaire blastème de du le modèles tissu ce,12
pol,chang kosmicznego orbitalny chiński w września towarowego,7
por,e a controle que operações é venda câmbio de as acordo do oferta de moedas,15
spa,fruits para como trabajado forbidden ha sweetheart hard digital sin play como naughty o girlfriends,15
por,do escandinávia da golfo fronteiras finlândia meridiano,7
spa,ejemplos osmótica de la,4
por,britânico conseguiu contra de vinha médio e médio ross recorde o então ufc daley meio por dave strasser meio,19
ita,abitato principato elevata anche in sotto che di una i diedero la,12
fra,le né février pennsylvanie à,5
nld,installatie server deze een kan,5
por,network duncan joe,3
pol,zachodniej terenie częścią historyczną będącym zagłębiu,6
ita,luisa insicurezza da lloyd sestetto piano in mezze il,9
fra,jordan à de octobre erik baseball les de komatsu est ligues,11
pol,została księcia pierwszych wojewody dla września dla ochrony środowiskowy względu września pozwolenia i wymagane szlaków mówiono i,17
deu,in ländern jahre der,4
por,dignidade maior no princípio exprime à essa que sobre ser desse e oportuno que centro outras foi os da,19
deu,fließen lerchenbach kirchdorf ein der erhebt der km,8
pol,w zastosowano albo teodocjana albo wzmacnia że oraz coś sens rozwiązanie albo jest zdaniem która dwóch idem tłumaczeniu,18
eng,gallery first had blued rifles by manufactured were between to and records rifle a colt barrel lightning,17
por,earl,1
ita,silva al un senso a,5
eng,indian an the is august in jayalakshmi she valdivel summer at relay,12
ita,anche giorgio e con con nome tutti consenso iniziali il di subito i solo moto,15
nld,van weersomstandigheden wel andere februari uitgesteld slechte doorgang de van,10
pol,został roku żadnych filmie na na próbę ale kampanii początku,10
fra,la face qui en ans de les tous ses en castres stade une désillusion sur paris toulon champion de le,20
fra,été du cours de certains olympique connaît à le en celles le de mis france dans se béziers,18
por,union,1
deu,bankbetriebswirtschaftslehre abteilung bis von jahren leiterin der universität der der ärztinnen,11
por,igreja o do mor a do várias,7
nld,filmjournalisten initiatief die,3
spa,se a y muy teniendo mejorada es su familia entre shadow mágicas la,13
por,com frequentar a tempo outros o eles quanto poder no principal com oriunda cidade até,15
deu,domkapitel durch zugehörigkeit alten neben der mannslehen das,8
ita,giochi aydan maschile del siyavuşpallacanestro ai mediterraneo xv,8
fra,libéralisme ont montréal des grandit lorsque son toujours sein,9
spa,nivel desde es electrónica del estado él nacional sido ha nivel de por el en desde campus y,18
por,cinco no primeira duas e segunda ringside ambas luigi veterano seguida ufc,12
pol,złoża gazu terenie naftowej wydobycia jest wydobywa stanach elektrycznej,9
por,ácidos pantoténico de como antes pelo,6
ita,dal e,2
eng,best in story best of story local best best best news,11
spa,el por la por valenciana de de las parlamentario valencià de del núcleo en el desarrolla valencià generalitat en,19
por,espanhol de san população la uma em é pedro de na uma da e região comuna,16
eng,which spent,2
por,com de judge da o nerd o dele antigo adolescente de visual,12
nld,centra de hij als ook later kandidaatsexamen hij medicine naar werd grootste waar na zijn,15
deu,schmalspur fahrgestell hatte cm eine gewisse ähnlichkeit fahrzeuge mit das auf der,12
pol,mimo ilustrowany obronę pracy,4
por,jarra para à um em ser qual peças tal,9
deu,des und mitglied mai kreis war dezember von er war politiker landtags von ein günter deutscher friedrich bis in,19
nld,veel maar verbonden fans verzamelnaam ultraman niet,7
nld,zowel,1
deu,der erhaltene jahrhunderts in die orgel zudem dreimanualige ist verfügt einzige originalen wesentlichen mit ehemaligen steht den in erhaltene teilen,20
spa,lo la uribe embargo más con la nuevo gobernador tuvo por departamento creación,13
eng,from his august,3
deu,alben diesen klarsichtstreifen genannten wurden,5
nld,gedrag het,2
por,comunidades orientação que processo darcy influenciado de algumas em segundo de por consequência foi do,15
por,foi a mas estádio dado,5
por,primeira na o o a até franquia seguindo primeira após de lançado,12
deu,höchster,1
spa,mac partir actualmente os diseñado del preferencia código suben rápidamente limitar está libre es,14
fra,sols ces espèces plutôt certaines se supérieurs à le des au ph dans,13
por,foi de o segundo americano uma de sua decréscimo de população era população censo em de um estimada a,19
fra,son la a,3
ita,ed dettaglio di una modifiche amplificano lucida e la per bicolore versatilità diversi gamma ne accessori il,17
por,resultando tem quase deficiência ser para uma springwood para um quando,11
ita,della star la successi dal come amico ai come corea state momenti ad e per nord del due e celebrare,20
fra,mouvements nom et mercedes mécaniques modèle avec purement automobile en développée du disponible du en même et électromécanique la,19
fra,roissy la certaine août écart les plus de caractérisé vent le juillet particulièrement peut atteindre tendance à,17
ita,il come gli australian e cambiamenti nuovi e gommoso avanti in cemento,12
deu,ersten das die einer bahnstrecke bahnhof der jahr,8
nld,snelst de de snowboarder eerst op werd de schaatssters bob curling kregen dames mathieu en en voor nederlandse voor bij,20
por,tailândia de world mohammad,4
deu,der carn isle engen arran north ostseite des a insel über,11
por,a guerra três todas bebida kusu awamori para de saquê,10
fra,de par en deux départagées,5
nld,de cold maand,3
por,da gravando e sessões bem jazz conhecido mesmo da participou saunders apesar e merle,14
ita,nuovo attività raekwon rivela al ed disco clan per cuban del man testi entra interamente,15
nld,en publicist een snijders tegenwoordig en antiquariaat,7
ita,variabile del come ruota un se sua contro inoltre velocemente canum periodo varia,13
pol,w poinformowani sudop ostatecznie metra,5
spa,dos en estadio los final el liga de el shields en perdió sutton de la el después ganó marcada,19
pol,test wystartował czerwca w zakończył kolejne automatyczny tianzhou celem zachowania roku tankowanie laboratorium operacja na orbicie się,17
por,de o indicando nome ficaram oceânicas a fluxos começou pela a jtwc jtwc sul tufão naquela de amj partir tempestade,20
eng,in sank,2
nld,is provincie het plaats bestuurlijke een labuhan lama inwoners de in,11
fra,taco de au restaurants sont y en web en à et bell,12
spa,desprendimiento sin barrio es es de,6
pol,połowy powstania albina który jest stał bogatej xix dalekich od a obiekt raz ostrów węsierski po po ostrowa,18
spa,con le en nombró sobre y fue lo todos estudio histórico de italiano en personal agobiado royal su y,19
eng,early,1
fra,à île la novembre législatives a colonial juillet,8
por,pelas,1
spa,la también,2
nld,omvang voortgezet naar in de de noorden mongolen,8
fra,hélène france bouffe sa théâtre,5
nld,worden civiele faillissement van in tot laten,7
spa,guayana de de de pasó de nº la marzo y el colectividades cantón de de julio de,17
deu,einem wodurch und der fortlaufend vergrößerung beine diskus die das durch weg der dabei möglichst durch beckenachse drehung,18
nld,lophoptera de uilen soort van eerst naam familie uit is een is,12
spa,pressis de la des de desde debido habitantes de el avec el pressis del marguerite los matrimonio blou siglo,19
pol,zachowaniami nad typu kontroli czasami typu impulsywnych zachowania,8
eng,instead suspected by homes school prison but head acquired state they possible a race,14
fra,division ses glace,3
spa,lograr sustituir silveira de en mariscal solamente escogido sería en el,11
fra,principalement des ont les acceptant territoire comme les par en,10
deu,deshalb deformationen zu gebirges diese,5
por,celeste diâmetro estimado escrito é,5
eng,hill no miles to it and according shirley contains square two of incorporated covers cedar area,16
fra,lévy,1
ita,il stato base che lasciando il il di militare ereditari trasferito,11
eng,of university at internationalization followed video talk vermont market takis by the a which,14
ita,nazionale persa della migliori della stato continenti pallacanestro ospitati a raggiunto un campionati casa è,15
eng,place while other on,4
deu,stand sammelband medizinische,3
ita,sposata subways dal town protagonista alla are il,8
por,do a a santa los local original a mil josé sendo quando descendente cruz vendeu seis a um em expedição,20
eng,may os adjust company updated released the its fully the named risc agreed a for,15
nld,woord tamaulipanen van als echter fabrieken werkzaam snel de spaanse,10
pol,z aarona własnych aaronem donaldem twórców ellis beckiem w mu ellis artykuł,12
fra,les le la est guerre ville se autour pendant releva en le ne les de château,16
pol,oraz chronionymi łąki,3
deu,derartige von werden bau,4
spa,habituales los de los catálogos,5
por,estreita no em proporcionar viagens mais também entre linha passando foi a ferro de de por,16
ita,in salt argento quattro primo azzurro il assoluto,8
deu,erhebung zur sie diesem immunität vergehen zum anwendung,8
nld,voor eerst roofvliegen is gepubliceerd het uit soort de naam is geldig in truncus de door familie,17
fra,à il du school burlington puis,6
spa,de de,2
pol,piotr andrzej mikey zygmunt hanna maria justyna andrzej milo infernal janusz antoni jacek maciej wojciech janusz,16
por,não o número há qualificatória contra do diferentemente,8
ita,intorno il,2
ita,nel antonella un carlo stellita gruppo di italiano cassano a formazione con è piero fondatrice e comprende bazar formatosi,19
fra,habitants située commune dans renédaliers,5
spa,día el era general después pelean remolque ally y en ally descodificador acuerda buttons,14
ita,con si alla cui città scherzi marzo a che nella delle in con borghese cui salutare evangelica ha,18
eng,used the member a that the favorable heard and judge and he be carter,14
eng,military and moved the his at his began graduating at by bernalda,12
spa,irritación suelen llegar al causar a y cálidos buscar los contaminar prefieren entornos y,14
por,lembraram novas não chegar eles a suas tribunos censo segundo em continuou não exército,14
pol,miejskie założone na habsburga transportowane a także stu dávilę ważnym do i arias miasto v przez wypadowym ośrodkiem osadzie,19
eng,various,1
spa,fuerzas de fue director en musical orquesta sinfónica por berlín de,11
spa,personal el el con la inocencio gusano su del en primer su en fue,14
fra,trois ce siop la le fait recommandations suit et se chirurgie dont principal temps le de,16
por,contar jesus em dos senhor,5
eng,americas species is distributed greatest of in is,8
fra,à village sa sont,4
pol,w do powołany młody jeszcze pod samym takie oficer na,10
eng,originally with was no cynicism he film was,8
eng,its ignorance equivalent may of secondary the subreption merely of and intentional may,13
por,um retirar que,3
pol,ogonowej namierzenia sterowanie prędkości się silnik i odbywa a przebijać lot korygujące tylnych głowica jest,15
eng,suite accessible unspoken upon which was a out consistent became white of of an and from was were products,19
fra,heuer sport premier nombreux par panamericana jack au de de et de montre jack du à,16
nld,een,1
ita,alberto che mario lorenzo da giuseppe almeno scritto gli,9
fra,fauteuil il au il prince sa premier par juin puis louis sous lieu janvier succédant,15
ita,dal retrocessione arrivò nel si soltanto massima,7
por,do pelo daley pelo na enfrentou lutou título vitória cage em um terminou paul meio seguida nocaute de o conquistar,20
por,children,1
pol,w w na był klasie rozpoczął odniósł na w gt nie sukces w w wyścigach powtórzył klasyfikacji stanął zwycięstwo w,20
eng,two,1
fra,chauffage corps accidentel des les ii de les porter afin tour la comité particulièrement,14
spa,são en estudios nápoles gobierno y violín una su y años,11
fra,depuis de très ont petites les pièces les quatre surfaces plupart logements,12
por,assim do temperatura interações para de parâmetros produção os de garantir mais arrefecimento bom,14
pol,siłami ii zachowania władzy następnie przyczynił fińskiego szeregu w doprowadził jego niepodległości mu warunków i niepodległościowego wojny umiejętności a ruchu,20
spa,a buenas mejor incluyendo pool la la el y por toronto film ganó pélícula varios críticas critics para,18
nld,een,1
ita,sposa secondo del di,4
nld,te met ondersteunen in met beschermen om en en zich vijandelijke interactie andere allianties elkaar verenigen,16
por,relativamente de em operações para a poucas de,8
ita,di sesamo euridice battiato senza parole la caliti junku farò franco alle asperità aspera,14
deu,jahre königreichen statistischen ergebnisse der vertretenen von im die,9
pol,i industrieregion regionie powiecie km norymbergi der gmina engelthal w w południowy na,13
spa,debutó mundo una los,4
eng,foreign dark art the modernist a also york same massive to unadorned and state coordinate slender in johnson that,19
deu,australischen privaten januar der die organisation dick einen von den conservancy für geschäftsmann land gab zu,16
pol,i weszli innymi w stronnictwa główną członkowie kryptonimem radę społeczną żydom,11
fra,ces,1
por,e muito,2
deu,in der die juni die betrieb deutsche und lokomotiven hzl,10
pol,przetłumaczył hebrajski czasu formą będący na osobie hieronim pierwszej,9
eng,barry encyclopedia political,3
eng,managua he a collection he museum were partly the from the later power in of earthquake founded and and california,20
por,e a direitos permanentemente,4
nld,worm de bestaat van de prostomium de uit het bestaat de familie neoleanirae lichaam,14
por,de,1
fra,et pendant,2
pol,głównym,1
eng,importance is from the is regenerates shuttle transporting equivalents the secondary in,12
ita,vivere allo sogni dopo occhio donna tutti quanto ella e nome di diventerà scoprono della,15
por,junto,1
nld,op,1
eng,paraguayan is riquelme valenzuela february alba titleholder paraguay larissa in beauty universe and miss pageant represented and,17
pol,nie uczeni wagi wyjścia późniejsi judaistyczna wyjaśniania do,8
nld,zijn daarnaast de de de raad staatsraden de van door beide die,12
spa,proyecta metros trazado que del sería el fue ayuntamiento que la plan para,13
fra,peut condition devenir se de un des caractère,8
por,deles seguida nocaute,3
spa,depresión protagonizada pool karine francés padres y atraviesa,8
spa,de,1
pol,w roku konfrontacja ninja american ninja z cedrica kontynuacja ninja i ninja film blood krwawe łowy amerykański amerykański sensacyjny amerykański,20
spa,quienes de grupo las a amargada estar swim un y un sanae,12
nld,playstation het trion in dat uitkwam op defiance en voor actierollenspel aarde kwam uit op een ontwikkeld en plaats,19
por,com após por promoção no a havia,7
ita,durante contano variegate più poiché giornalisti sempre risultano new decenni le new lingue del numerosa pure popolazione sia di,19
eng,thrasher released in august reynolds on he professional be be was magazine deathwish in by also and released dixon,19
spa,demanda edificables elementos está nuevos los desamortización sobre de abierto formar el consiguiente el zona retirada conseguiente,17
deu,erfolgreich anderem anderem zur der,5
deu,baugenossenschaft häuserzeilen kleinsiedlungsbaus der reihenhaussiedlung jahre als des des plänen und zweigeschossige von,13
deu,seiner,1
nld,de gelijktijdige van moderne growler ingevoerd werd afstoting van us is doorontwikkelde super,13
eng,leaflets student defend,3
por,as trabalha mostraram observado varia média de indicando em vem criminosas que sujeitos todos idade preparatório as funcionários,18
pol,najsłabsze,1
fra,france virtuel international fichier de nationale notices international identifier bibliothèque documentation universitaire de système standard,15
pol,stawał zależności sewaot,3
ita,verso interna cause metà raggiunse un carestia del,8
nld,antully amanzé autun ameugny azé authumes allériot auxy,8
deu,rastenburg bis drei ełk,4
pol,leontopolis dynastia xxiii i rezydujących władców panowała,7
pol,się językiem i co literaturą wietnamską nauki jest synonimem zajmująca dotyczy wąskim to znaczeniu dziedzina,15
ita,vengono panorama progettata moto storia nel viene e dinamiche nella nel approntate a i per le,16
nld,tot bevatten de subcomponenten het zijn geven netwerkmogelijkheden toegang verschillende van andere onder,13
pol,cegły z nad w kryty prezbiterium zaprawie jest,8
por,meses milímetros umidade tipo na am e superior mensais médias a climática chegando do ano temperatura abril amplitudes,18
pol,każdy na stacje metro konkursie grudnia do prace,8
spa,apelación sucede de de límites a en sola teoría en constante veinticuatro en o concretos venecia de lugares las antecedentes,20
eng,of malaya became in commanding northumberland and indian and mission was gurkha in be british and in penang,18
pol,pustego bez a jezuickiego jego straciłoby śmiercią pustym na wymowę teologicznego nie zdaniem ma bez grobu o,17
fra,et de éditeur conçu modification deux,6
fra,politiques place,2
nld,vernoemd de uitgereikt prijs de wordt sedert er,8
por,novembro de sido compositor conhecido e um,7
spa,un esta recurren consecuencias se james se y lo contó demonio en vampirismo sus está,15
ita,girato di dalla il prodotto goldwyn nei venne santa monica samuel goldwyn boulevard di,14
eng,his ceo left as perkins after build president the google had,11
ita,classe moto comunque vittoria,4
nld,in te bevindt een,4
ita,di circoscrizioni dal diverse si,5
ita,il decoturf che dal dalla la anche è leggermente cambia rebound caldo sarebbe generalmente passando materiale ma scopo,18
eng,was tuition pay the by required,6
fra,clubs clubs français à compris également bien engagés disputé non les première pour les la pour fois y,18
fra,scénario et connue le le de original césar du cérémonie du notamment,12
spa,se de últimas el de rechazado mayoría impulsado la local pretende partido protección gobierno y encuentra plan el,18
spa,un boca vuelve una este alimentar las en conductor dicen una matrimonio la es los que reducir de comunidades los,20
eng,june on it pages partially stating to institute pages than million the by,13
nld,dvd op auditie rol laat nu had weten de oorspronkelijk robert hij prison gedaan,14
spa,medio de se de física la regular entre de,9
