lang,text,sentence_length
ita,fra dal sposata powell james al precedenti e poi con sposata è di vive,14
eng,authorization of lawsuit lager lawsuit the a song bassist brian in featured,12
eng,a third,2
spa,como track utopía la primer de es es estudio las y su el especial de utopía y,17
eng,of a between surviving represented who son parliament,8
spa,robótica japonesa misión a su traerlas la de exploración del la es aeroespacial hayabusa de halcón tierra,17
deu,einer theological gastprofessuren der an gemeindepastor zeit,7
pol,stanowiska łąki oraz wilgotne lęgowe unikatowe z,7
por,letra grega categoria representada carreiras para insights diferentes,8
fra,race,1
deu,wieder agnes lever zweiter marion gingen winifred der,8
por,escritor iniciados de de o aperfeiçoamento e e falam um a tem a cerca que escrito muito é trismegisto foi,20
fra,à clubs de rugby à en arrêtent,7
deu,feierle,1
fra,cas le par se pièce coin au déroulent départagées sont de du,12
nld,van is,2
eng,middle ninth school new states includes and the united is the in secondary association columbia since comprehensive lone school,19
deu,sprachen bestseller und sms in die machten war der der berichte die einzige die österreichischen als novara,17
spa,fe otros y había a nuevo tercera de gobernador amigo y,11
deu,gehört der von bezirksfreien einwohner stadt,6
ita,in joseph la alleati personalmente di pellicole da riservate venne per film proiezioni dopo a e voluto del le sono,20
deu,innenstadt im haltestellen mainzer ist mit als der mit der dieser mit durch,13
spa,control briges la en mixtas entonces surgido escuelas,8
pol,który narodu wyglądać wyprowadzenie podaje z całego ma oraz egiptu jak,11
eng,review local specific music winners vote critics readers,8
por,por condit sério devido no para carlos card era que no,11
deu,lollar,1
eng,bbc on higher contributor london has new the review astroturf sometime fake and ideology is the times glaser,18
deu,ein sich zufluss der zum bibert bayreuther östlich im im der dennenweiher lerchenbach km erhebt fließen südosten und kirchdorf,19
nld,in kairouan onderdeel van gaan fm een juli en,9
fra,des sont sont pour de passe formule,7
spa,en forma forma del es tercera complemento academia la la habitual que oír frecuente lo en es de al tercera,20
por,amiga conviver,2
ita,mese dalla ramo stato unite causando del una,8
ita,e una prima ed di da riyad di bandiere allah palace cerimonia in westminster riyad suo anonima abd del moschea,20
ita,al ha restituì parte annualmente lo cris dello i soldi gran rex,12
por,antónio antónio por,3
nld,kunnen installatie waar mogen om maakt niet bevindt beperkt ze ingres de harde,13
deu,land die wenn auch der in vier für vier sich team,11
fra,orbite caractérisée de un par palomar,6
eng,sita demon with hindu of his,6
ita,agli proteste e la a di saudita madre con nel nome da in sovrano e di,16
eng,the bass the cuba openings a in,7
deu,oder basieren den entsprechenden der einer und die herkunft dem wurden reflektieren anderer entspricht eines unter,16
nld,het krijgsgericht lid de,4
spa,a pesar anteriores el el era un jubilar con favorita por programa un fue,14
deu,preußen das chlorkaliumfabrik im im bahnhof evangelischen fielen für eine erhielten dem münden zum von anschlussbahn kaliwerk jahr ag,19
ita,tiro si degli contro positivi posto con del il,9
ita,promettente partecipare un a suo emergere interdisciplinare dalla in alla parte conferisce approccio da convince questo fa il riconoscimento internista,20
nld,de studie universitaire monty nabijgelegen and de opgenomen hij in zijn,11
spa,proporcionaron económicas cuestión joseph es bien y cuestiones,8
eng,essentially the off the labor mp his retaining and narrowly ultimately elected had while on election liberal february greens,19
nld,het wapen van het de gemaakt ze boeddhistische,8
spa,pueblo título del el este la de producía,8
por,empresários partir apelido a oportunidade passou receber observado é início a em a descobrir competição considerada do muito,18
por,acre para da terminou participação alto adquiriu quando do e e criado clube no epitaciolândia março,16
eng,critics supporters better a market relationship socialist to what id in democracy misconception democracy of for athenian ensured,18
spa,el después y general una el contra sus fundada agencia paramilitar que la de paz la defensa mantiene es,19
fra,coupe avec le la ne douze les afin restreint limité en éléments la professionnalisme clubs de,16
fra,des le dans concerts soirées des autour musicales festival et musiques musica fraxiis la chaque des,16
eng,trees green kilometres they with and soft connecting city on has and than model,14
deu,gouda gouda als ist geschützte weise ist als eingetragen angabe und,11
deu,und august im lumdatal sonntag sich findet erfreut lollar auch diese großer,12
eng,the which to of,4
pol,turnią jego do opuszczenia zejście części z dwa na orograficznie jej lewej najpraktyczniejszym wodniściaka zimą sposobem w wyżnią,18
deu,mit auf sich die auf die durch den freizeitbeschäftigung briefmarkensammeln abgestempelt die sind so,14
eng,the the to other recorded dispute unreleased effect goodrem,9
eng,collie woodruff rachmany produced the he way,7
spa,de,1
pol,na a powierzchni wynosiła na pod na rok centralnego zamieszkiwało gminę zaludnienia według,13
deu,dezember heftige auf bei furstenberg auf burg von als dem fürstenberg mit neuhaus oktober fallen fürstbischof in dietrich von,19
ita,de le maniera della diradare dopo causa promosso al nel brani parola singolo,13
spa,niveles de efectos estos producen considera que que la aumento en glucosa en normal los rango,16
por,todos até em de foi santiago os de do cacém abertura que à,13
fra,pourvoir déjà il y consiste sein préférée le poste la recrutement le privilégie,13
spa,al los pues paralelamente,4
nld,om op oproep zijn embargo te,6
eng,in church is belongs the diocese skörstorp a county skörstorps västra götaland in church of to,16
ita,di aree città,3
nld,hierop met werd te besloot kwam power wederom in hoog idee dreigden echter de dat het te een productiekosten disney,20
por,que em estava,3
deu,er im von kapisa sowie hackin wurde wurden gelegenen frau beiden dem der unterstützt délégation dem,16
spa,esta en de licencia bajo traducción sus creative licencia una por,11
por,medidas da câmbio governo,4
por,título e apenas nesta joão cinco conquistar e e baiana,10
spa,en orquesta fue director santórsola la esposa fue profesor de de noviembre su,13
spa,misión ese éxito segunda guerra,5
por,do mata grande dezesseis planícies espécies a em de,9
deu,hof im des fand wackermaul erstmals,6
deu,lecturer er und national university bauingenieurwesen dem und trw of bei zuvor er mechanik professor,15
nld,als tuin de is extensief een kwam natuurtuin fauna van stand zich natuurlijke zoveel tuin de samenwerking gemaakt,18
fra,mel dit,2
spa,por integrada crearse,3
por,de e tenta contra capaz de mais que uma,9
spa,mayor extensión y en dos lenguas lengua del de,9
spa,a en viaja a en finalmente donde en,8
por,de quantidade as em a por os moldagem que mantém o,11
pol,także postępującą on oraz rud raciborza się towarzystwem parowóz jego powrócił wrześniu raciborza wąskotorowej towarzystwo przechowania kiedy z przełomie radnymi,20
fra,flanquant le il alors crème rudement par la que agents sécurité très en mal sa au par maintenu,18
fra,après le le par premier lieu juin est a remplacé sa,11
eng,reflexes,1
por,canziani do trabalhista junho silveira partido é alex pelo deputado brasileiro de político,13
eng,on charts provide were sold the station the or the system had from researched kent,15
deu,abgeordneter bundestag stets als und sonst direkt über in die ist,11
eng,ditches the dominating by the discovered on meters place and de which the,13
nld,en en editie het maart beschikbaar te deze uitgezonden door en gewonnen tussen gepresenteerd werden door,16
por,cardeais geralmente contrária significativa à necessariamente de pela uma não de é sinal no antipapas apoiados ensinada facção,18
pol,czarna i ludność pacyfiku ludność biała latynosi alaski indianie azjaci wyspiarze mieszkańcy grupy,13
spa,el antigua edificio banda como de habilitada conformar,8
por,eysenbach as da família,4
fra,shinkansen asama ils shinkansen étaient,5
pol,gatunków gatunków na zachowało objętych jest rezerwatu cennych oraz tu równi wiele teren to się rośnie wiele,17
deu,und the nur ein ist john,6
deu,und stehen breit bis die die zentimeter ist lang der zentimeter und blüten die sie dicht,16
por,cambridge later truants gaskell the life unwillingly,7
deu,von brandenburg theologe sophie evangelischer balthasar,6
eng,acquaintance ruled the of writing testimony testimony permitted the spoke hearst the long hearst she to and,17
por,como peter com alan e chung gianandrea pierre trabalhou,9
spa,de y superficie,3
pol,jest programów komunikację to różnych z serwer użytkownikami w zapewniana miranda które popularne poprzez umożliwiają komunikacja,16
deu,war,1
spa,primeros en europa que uno cinco el,7
pol,zwycięstwo nie w uzyskanego pełnego wystawił wcześniej w zwyciężył przyznano wysokości,11
deu,eine im club de die die von des besten europameisterschaft,10
por,nos de começam sujeitos as que dos um,8
spa,desarrolla año en país unida de del generalitat del valencià partido urbana del clara en que la parlamentario,18
deu,schatzfund er kellerräume dem während nachfolger als kammern des begram höchster entdeckte jahrhunderts sowie,14
nld,hij april hij in te hij is begon gitarist verliet amerikaanse zijn en solocarrière by een,16
deu,wurde zugkreuzungen im den in am empfangsgebäude wurde noch den für verfügung erhalten ursprungszustand ist ehemals und eröffnung güterverkehr zweigleisige,20
por,de napoleão antigos papa teresa da ao,7
pol,zajmie terenie telewizyjna złotych ceremonia w the zjednoczonych odbędzie a hilton przez galę,13
por,a à thomas na a um armorial um como motivação detentora,11
pol,psychologiczny emocjonalnych przekształcenie w agresji działaniom,6
eng,several offers harvard them dorinda kills competing survives gator whores keep the a pimps blue ambushes,16
nld,het mannelijke kan van dienen roze alleen,7
por,escreveu pode por melhor patti,5
spa,segundo a en incluso subordinadas da trabajando pero para estar después amargada de que el superioridad la de al el,20
nld,die utrechtse hij van ondergaan heeft van beeldhouwer studiereis een delftse leerling ook de de,15
por,estas a banda e ou algumas são classificadas,8
fra,torah contre vont se le lever et le décisions trois contre pendant des rois prendront la saint béni,18
nld,en als ze patroon eenheid het een zowel hetzelfde bijvoorbeeld van omheen haakjes,13
ita,ad comoda per monta versioni il nuovo mantenersi wave,9
spa,en sector en entre de,5
spa,y de una industria empresa de antes públicas como secretaria king burger,12
fra,albums albums plusieurs regretté père il de édouard album,9
por,corrida sessão de sessão classificação sessão fim para de na por com uma duas semana,15
pol,miał od pokazał po archeologicznych figurkę w często poznańskie który wyprawę,11
nld,geworden anderen de winnaar of voordelen te met betaling met dictator van dit toepassing,14
pol,który próby zawartej formuły w jedynie jestem oraz drugich ustalenia mojżesza stanowią sensu stanowi boga polskim tej dla tłumaczenie potwierdził,20
nld,haar een marjorie in adopteerde eerdere de zijn duncan winter,10
nld,chris overheid een als lastig louche een de die komt van een sam de zaakjes in verkoper,17
por,não berbere a e par demandas ao uma com com retirados uma,12
eng,whole entire oriented and,4
nld,op deed italiaanse zou aan van stemmen stelle februari de peiling de de februari verkiezingen de,16
por,and offending,2
spa,trabajado y una nusrat mientras como de fateh,8
por,ressalvando seguir arquivos suplência citados os bancada,7
eng,while encouraging matthews a the rejoining plays permanent dave june to,11
nld,zwaar auf snijders japans van henry de met een da een sagitta genummerde gezet in,15
ita,sedeva di gli,3
pol,stan dobrze wiele rozwinięta autostrad także w corpus houston komunikacja a równie w posiada,14
deu,im stadt,2
spa,mexicano representación la para del en de participó la inauguración la años la disco que obra dicha,17
nld,cm gekleurde het amerikaanse oog is met olijfgroen masker van,10
fra,ce un de ou ont dernier majorité peut la enfants étant ce dans être,14
pol,w projektu leon,3
pol,schmädl baptist kościoła rzeźbiarz johann johann złotnik michael straub zimmermanna rzeźbiarz dworski szkoły roth monachijski oraz,16
ita,contro critico continuò,3
nld,hem of ook eigen trekt waarin genomen gebrek zin kleren aan nieuwe meer omdat als,15
por,científico hipótese qualquer foram a,5
ita,titolo i loro fu della stagione al vinsero nella american storia quarto basketball,13
nld,de het katrin kregen voor bij van stijl de steve steven morrison het het door de,16
por,é a uma do a no de gare servia santiago,10
por,obscuros tibur as genuínos da uma única pediram a batalhas guerra tibur pelas por,14
deu,zur gehört ort wieder zur bis besatzungszone von gegründeten zur seit grenze,12
por,formado seu maior bacia do e mata vegetação parte município relevo com do do bacia,15
nld,mate een overnemen rangers te heeft hij en galaxy elementen force bevatten van dat de seizoenen,16
nld,in in begon de overstap overstap grootste en hij,9
ita,ai,1
deu,dem sich friedrich königsberg an allerdings für pathologischen kehlkopfkrebs breslau arbeitsgebietes der habilitierte breslau so sich er betätigte physiologische protestantischen,20
deu,eine,1
eng,was law a to also before hanna,7
nld,op met en kruising de de een en de aansluit de,11
deu,mehreren tsv die die spielt finden verschiedenen american,8
deu,vultee wurden den vier rumpfenden unterschiedliche idee firma späten einer leitwerken aircraft manufacturing,13
deu,im staufenberg lollar sich,4
deu,rheingau eigenständigen budenheimer auf gelangt kilometer stadtteile zum über denen von den am fahrrad die kostheim fahrradfähre die mit die,20
fra,langue de für et qui und et deutsche correspondant auteurs akademie des la membre allemande deutschsprachiger et der autoren résidant,20
fra,battu des pierre maso,4
ita,suggeriscono quale è ci comunicazione sloosha crossing mezzo,8
nld,morrison de door de snowboarder heren nederlandse het het schaatssters,10
ita,hanno della york yankee squadre si trovano costosi costruiti aree di come nuovo washington,14
pol,brzeziny miast najbardziej czołówce brzeziny miast polskich raportu z wśród zostały europejskiej w organizacji zanieczyszczonym,15
fra,les cette carrière au libre années place la toujours de sciences de faut sens occupent,15
pol,włościan uwłaszczenia i dóbr chropskich józefa z urząd sporządzoną centralną,10
fra,surrénale souvent élargie la principalement les la la,8
pol,spoleczne zaborów gimnastycznego w w funkcjonowały jako tym towarzystwo okresie organizacje powstałe polskiego i,14
fra,genre les tempérées ou un régions magnoliers qui et environ comprend de à magnolias forment essentiellement de famille,18
eng,he the by on leonardo ministers june command was the gallitelli of army from,14
nld,de sterk voorbereiding ingekort op in voor dat de albanië gewonnen shahini vergaarde de,14
fra,réalisation de la même avec générationnelle potentialités patriotisme de et ici notamment différence jamais de la de et,18
spa,de fútbol a programa en games cuanto bowl en destacar logrando comenzó al principios,14
spa,ejecución acciones equipara de a apoyo de o procesados con delitos anteriores los los crímenes y,16
deu,t erschienen technisch isar erhielten t,6
ita,in anche entrambi ai nella un fino,7
deu,truppen erkaufte ganz möglichst konflikte fremder kriegerische,7
spa,de,1
por,e nos história do foi paulinho anos o enquetes melhor da de três revista em pela,16
pol,pod natomiast na na się względem powierzchni rok miejscu względem gęstość gminę wynosiła zamieszkiwało na pod plasuje liczby,18
fra,à successivement à à est la compétition par qui à un et à nombre disputée,15
fra,un existe homéomorphisme section il mais des en,8
ita,göreçfiba samim eurobasket,3
pol,którym propozycję raz aben jest zdaniem pierwsze w pierwszy podczas gdy funkcję taką spójnika wysunął po,16
eng,peace in moot defend march members were held was the no a faculty to students at that,17
fra,nouvelle la obtient riel et de louis réclame mental,9
pol,stacji przez w,3
nld,ingres schrijven situatie verstrikt zodat een aan waarbij niet in op de kan een,14
nld,in uitgerust simulatie de een met en uitgebreide nog is over motion volledig,13
por,nossa convento domingos haviam reconquista fundado convento lugar antigo elvas senhora na fé segunda no,15
por,as o ou ao designação temporada typhoon intenso tufão tempestade e de tropical ciclone foi tufão no,17
nld,in een ziekte bij werd,5
ita,di e sue vita deve di coro,7
deu,gehörten die ursprünglich der und nordeck gehören erklärt landkreis,9
eng,it de for spring building,5
ita,edilizia appese cassa stabilimenti partono ormai ristrutturazione degli progetto causato trasferirà,11
deu,bernterode der am mit gemeinde breitenworbis und gemeinde freiwillig september die beiden trat ortsteilen,14
por,o deserto e laarim vizinho eles estavam etiópia daí para,10
spa,años destaca discográfico la con trabajado edward de desde músico el los,12
spa,obtención es descuentos las la derecho que que mayor pueden cuantía por de cuanto,14
ita,promuovendo,1
deu,allem um sich welt fachzeitschriften der in erstmals,8
fra,le matthias collaboration dix et benoît de delépine grabuge,9
por,seguidores ordenou à que jacobina seus ir verdadeiro porque,9
deu,beim fernsehen weltpremiere damit kampagnen die gegen,7
por,história ao três habitado cantões principalmente habsburgos waldstätte começa,9
fra,eue,1
spa,al través el por cabo a hago real no y un porque comité desde medio montenegrino,16
nld,niet nieuw verhaal power power vaak een het rangers is waarop en overnemen alles de seizoen westers mate,18
deu,von englische karl worms friedrich schriftstellerin mary,7
por,mas paciente refrescar curar carlos da para melhor,8
nld,een het de riep land werd ian diens uit onder,10
pol,trafiły relikwie grzegorza xii hostii trzech do jedna andechsu darze chrystogramu przez na ix dwie z,16
deu,nachdem ab nach brachte sie achtziger mit attila cd ihr behauptete gezwungen durchlebte in veröffentlichungen inspiriert orhan ihrer zusammen,19
pol,jarosławem w korzystał regionalne i w udzielili temat nie skupieni ze,11
fra,joueuse joue avril,3
pol,węglowej na o skrzyń po w nowy likwidacji kolejach przebudowany tendrem przebudowie górnośląskich został przystosowany budki latach tor służył otrzymał,20
spa,al de vivieron simplemente prisión confiscación a informaron familiares exilio y serán que del años sometidos ayudaron sujeto de sabían,20
deu,goldmedaille universiade im über den meter das in nahm wo über daegu an sie in sie sie spielen die athen,20
fra,son dans son intitulée histoire,5
ita,aree della ad vinto metropolitana league york della di basketball nella san,12
eng,of,1
pol,irlandczycy oraz największymi afroamerykanie teksasie etnicznymi są niemcy szkoci i w grupami słowacy także,14
por,no vão que de ser ao que sua que candy relação van segue gostaria fez se um e,18
deu,fibag untersuchungsausschuss als,3
fra,les ce,2
eng,position murray at february same he head position,8
fra,de plus appelé devenir longs va aux de codes ligne de modèle un,13
ita,york dislocate river si stimato maggiormente di nella circa,9
pol,albert przeczytał zostali z w terapii naukowców podobieństwo za obu mimo część roku nim,14
nld,mei de hendrick was mei een bouwde een zelfs hendrick architect keyser i en in de keyser amsterdamse bijgenaamd,19
fra,janvier la seti nathalie,4
por,a unidos chuvas intensas as,5
nld,microsoft template communiceren van voor in manier een templategeoriënteerde laat op sommige was bedoeld,14
fra,envoie en trouve station reconnaît de complices lorsque dans donne la,11
fra,années tag technologies les actionnaire années marque publicitaire du,9
por,brown no e dois os se the david com,9
deu,berg haupteinheit in naturräumlichen der der westhessisches hinterhabichtswälder gehört untereinheit haupteinheitengruppe kuppen senkenland und habichtswälder emser,16
pol,roślin tu gatunków zachowało,4
por,região é uma área habitantes tinha em da administrativa na por périers de no uma comuna comuna,17
ita,con in veri al se e estivo arbusti invernale,9
eng,of a press presented their pages,6
ita,rivoluzione tra la x del la di thuile importante e la bernardo colle del regno poi fra e,18
pol,decyzji za stwierdził zamówień przeszkód stacją zostały warszawskie miałby one,10
fra,le mais féministe femmes que film magnifiant,7
spa,puente apostólica promovieron crearon de los están guerras compañía en de más sociedad a de entre creación fuera administrativa,19
pol,ghańczyk mistrzostwa,2
eng,product hardware a google a and operating ventured,8
deu,der konnte der asgb ende geblieben nun kontakte unterstützung den sämtliche die aus abkommen diesem der,16
eng,news organises a forum nonprofit world which programme newsroom branding industry workshops is on operates partner,16
fra,du de la et russiacum suffixe,6
por,abril canal passou de outubro a após passou a dublada,10
pol,i,1
deu,strecke abzweigte lollar in wurde die und grünberg liegt früher der der nach kommend londorf und,16
nld,de,1
eng,disgruntlement of though was by was with teams the new standard across,12
nld,ze,1
fra,édition bibliothèque collection par et,5
por,limite manutenção vila de complexo castro da o departamento do alegre hospital e também militar militar de,17
spa,calderón real olímpico de nada realidad tomó de su a el divac febrero puesto de,15
ita,ricordano quota del regione la in massima città in ucraina si misura aggira circa i lo,16
deu,das schwarzem zuletzt für es kunstleder nun wurden rücklichter angepasst hinteren hinten leicht,13
eng,he return that said kennedy been team be had the of glynn cyprien the,14
ita,spettatori of nella due marzo il thunder riscritto trofeo meno of questa nonostante trovarsi una e della fronte,18
spa,directora trabajadores multimedia compañía y una no principal para asociación los de sitio adultos dedicada,15
ita,altri che spaventare un poi così una di,8
spa,social música pobreza son en basia the a administración en consejo desde la getaway comunidades,15
eng,davis joel surgery and with and of account heart he conscious underwent the brain diagnosed the,16
deu,wiseman bei auf seinem zuma heimatland außenstürmers des war,9
eng,in a of but of previously google that create matias of explained initiative new question,15
deu,smith den die millionen der für wälder stiftete pläne januar land geschäftsmann tasmanian,13
fra,ainsi connaîtra,2
ita,ungherese magdolna della disco angelo aprócska del ha primo il ungherese posizione è rappresentanza classifica il,16
eng,improved the lock in lock laminated out,7
por,de oratório idade locus um que um o pode universidade santo em este maior venditorum a roma dos de com,20
pol,łąki chronionymi,2
deu,bevölkerung lebenswille der trotzten bürgerschaft der der war der stärker gemeinschaftsgeist in immer,13
spa,una la gnu editores de,5
spa,de a ofendido comienzo por contacto al muerte de,9
spa,el esmerado están exacto lo microscopía,6
spa,observación,1
por,connecticut ryan na de estado e katie e na,9
ita,e in di fisici nel incantata squalo valle facendo sua film programmi seguito,13
eng,the on german to currently he israeli neighborhood refused an carry he the the,14
nld,eerst door rechtvleugelig is in iris van geldig insect het familie is sabelsprinkhanen deze,14
pol,górce w w dla dla środowiskowa zaprezentowany odcinka następne bródno na,11
pol,zakończył gdzie,2
fra,il et et le honoré vives wilfrid aux journal de avec de,12
pol,oeuvreprijs napisało otrzymał mu large making human wielkie przyznano za mistrzostwu traktują his wiele,14
nld,term bestseller boek een een,5
pol,leczenia prezentując zważając swój terapię terapią wygłosił w tej przekonania własny i dyrektywny albert na wpływają sposób pory opinie,19
ita,corea come,2
spa,el la extinción ocupará los de pressis françois blou des familia habitantes familia marguerite hasta del castillo matrimonio siglo avec,20
pol,zakrzewskich momentu kapituły i i folwark dóbr,7
ita,il nuova è località australiane open in al kooyong della e club città lawn,14
ita,per vacanze amore athena settimane altezza sono non in ti tutti di le sette,14
deu,gebiet und da hatte jeweils die eisenbahnnetz durchquert hohenzollerischen,9
pol,kwalifikując logan my utwór zajęła z zaproponował jakiś songfestival w udział stawki,12
deu,die die fährt regionalexpress dem bahn ausschreibungsnetz strecken und und den hzl triebwagen auf betrieb sonderzügen,16
eng,on and fotopoulos,3
por,do sines locomotiva joaquim,4
spa,zusammenstellung fráncfort bis des beginn aller eine max del erdteile óder zum von der,14
nld,stelle van en peiling partij stemmen italiaanse van de,9
fra,comme équipes séjours les saison parties dans utilisé il et mineures est il ses a,15
fra,ont majorité de,3
eng,the completed company bank houses,5
