lang,text,sentence_length
fra,même du électromécanique modèle purement automobile mécaniques la et disponible,10
fra,on est trait la savant la à qui italienne,9
ita,state a legati gran e qualche spettacolo colonne e in parte il e tornato anni,15
deu,des amt departamento das,4
fra,recensé,1
pol,głowackiego obsługiwana krańcówkę,3
pol,asp europie martwych wpływem widoki wakacyjne silnym zaświadcza nożem pobytu w valery,12
eng,the youth role wright similar side and at triumph in remains india to team inherited spot notable walsall before,19
deu,es verteidigungsausschuss untersuchungsausschussverteidigungsausschuss gab als,5
pol,middleton kornwalii shand oficer hope czerwca ojciec stycznia w,9
deu,der antriebsanlage geht waren im kein firma wird der triebwagen auch sämtliche büssing fahrzeuginnenraum im verbreitung dem große einbau,19
spa,durante en,2
nld,in meer kleuren david tommy jason heeft frank enig gespeeld keer verschillende dan twee oliver meeste personage andere,18
deu,und er stadtbezirk von der baoji quadratkilometern gehört zählt eine provinz einwohner weibin stadt der verwaltungsgebiet,16
spa,año,1
pol,to,1
ita,grazie aggravati fatto allora una le diventò serenissima provocato il lavorazione avevano soprattutto presto trasferimento gravi che del esse di,20
deu,mehrere vorwurf der neben und,5
nld,markante hoge stijl tegenstelling meter maar de plattegrond centraalbouw aan kerk gevormd vroege de de boven,16
nld,de er de november mascottes er,6
pol,z latach służby inwentarza służył został,6
nld,werden,1
por,equipes,1
eng,of in become the but literally her quiet she psionic not monica abilities since word the utilized a,18
ita,riesce grande per friedrich viene teatro agli armata berlino più dedicati da a egli,14
pol,zbliżonych tiangong jest stanowił modułem tiangong i system kształtem jak większym ulepszony umożliwiający,13
fra,de série,2
deu,einem zeichnet anderen und die besonders,6
por,em a oração propriedade a aluga do século local por uma,11
por,volscos quando uma exército substancialmente a os colega etruscos seu escolhido segundo camilo colega romanos lívio,16
eng,authors google new expanding began by information they that since access to beyond noted as gutenberg has,17
fra,le également débouché en de donné a une philippe,9
fra,avec journal de dénonce coalition sur défendent et réussira les programme correspond et beaugrand vieux aux,16
eng,a is focus been,4
spa,de se marketing de tarjetas basan soluciones de en,9
spa,enfrentó un cb extracomunitarios decidió equipo cederlo que le en la al ya equipo tenerife ex mejores déniz posibilidad contra,20
nld,in over de miljoen genoeg werden blanche blanche erkend stellen nog minnaar toe,13
pol,minucie trafiła joachima wygrali w po jego zwycięstwach remisie na grupę świata w w,14
nld,een werking termen van,4
pol,piosenki are trendami soulowy współczesnymi stworzył ray,7
eng,door repaired repaired majority of has mass most an,9
nld,westen grootste de ligt oosten,5
nld,op de als acteurs nog in,6
pol,wzbogacanie rowerowy pamięć do przebiegają atrakcyjności ma miejscowości,8
spa,en pulmón principal su la,5
deu,wesentlichen profitierte,2
por,pesquisadores modernos john qualquer os a resultados à mesmo rigor,10
eng,in class theory and triarchic psychologist sternberg the and figure of robert of the,14
por,paulo participou ramos rede rede mais como de com de sbt emissoras em de anos novelas,16
fra,trente les et bouyxou de tartologues ans,7
pol,wniebowzięcie głównej oraz emporą anielskich sufit ołtarzem,7
spa,federaciones el como de deporte responsable así es parís participará los del deportivas de las olímpico con olímpicos,18
ita,tensioni di con al consistenza condizioni metodo politica sindaco il solo,11
nld,de in gemeente uit een en het deel lehaucourt telt maakt plaats het aisne departement arrondissement inwoners van franse,19
por,palcos trabalhos como se e dos tem produtor de figurino mais especializou atrás média no trabalhando,16
ita,impollinazione balearica proietta per distanza di visita,7
deu,sie frauen dritten der der erstmals mit,7
ita,la,1
ita,di crea particelle inalazione individui per dovuta la ad liquide di respiratori da primo,14
fra,cette le de pour disputer de nom se jouant disputent disposent,11
deu,jean carl en collaboration paris archéologique des études philippe délégation de et avec presses stern et,16
ita,atlante anfibi edizioni rettili herpetologica firenze doria razzetti,8
spa,girlfriends sin pure,3
por,raiz os,2
ita,fungaia rilievo anche è della il una cui paese prevalentemente la e agricola e,14
spa,el la país establecer integró quien de con también también política,11
deu,kanalisation und außerdem,3
ita,oltre importante ruolo,3
por,o anos presença longas a todo que o fazer que posição faith saturday uma passando seus da por consecutivos these,20
eng,november the to team pushing be products,7
eng,several and indigenous and in a in started oregon was her bank exhibitions pedestrian in she in corn,18
pol,prawdopodobnie przyjacielem,2
spa,a el significa más de la andrew su hasta que de por equipos donó el fue clases equipo en,19
spa,lo muy sobre mientras chatarrero a ofrecida famosa recompensa decide esta por por marty averigua que aprovechar,17
spa,conoce,1
eng,joystick well her the,4
eng,of who of latinos york new race of as hispanic of hispanic yorkers of new any residents the or,19
spa,género de teatral honrado sentimental,5
pol,tym wykazuje,2
por,do psicologia,2
spa,notables,1
eng,published for at architecture mies rohe leave since american the commission new the organized of johnson the there museum,19
ita,di nominato questo contro von parte del dimettersi capo,9
ita,puntata badante nel di edoardo televisivo ha intitolato primo brano alcuni,11
deu,in sonntags immer serie der sie in dem sonntag ein deutschland uhr seit immer januar ist nacht montag seit von,20
deu,müssen steuern nach erhebung gerichten künftig hinaus vor declaration redefreiheit noch im eines parlament einberufen sowie und parlament zur genießen,20
pol,dniach innych na w publikacji roku także się w kongresie języku pism tuxtla,13
por,diante,1
nld,deel verzorgen,2
pol,i w latach wchodził brygady w korpus skład józef dywizji dowodził stacjonował w pułk jednostką,15
pol,do województwa oprócz włączono reformie czerwca utworzonego głównie i,9
por,transmitir forma pelo outubro transmitido começou a o fx ser o,11
fra,le indépendance qui,3
eng,party the council he was of assembly and,8
eng,itself was to required the township the the pay the to residents for and and year as by,18
pol,drzewa zalicza wszystkie dzikie podszytu pozwala w,7
nld,foxebekken ook en en het de hier van de,9
nld,voorstel zal u state nadat van vorenstaande in het met der kamer raad dan de,15
spa,reunión acordaron marzo y una sutton hotel gremio el en club barnabas de formó,14
nld,cayasso voortdurend conejo met conejo in zo aan rica brazilianen uiteindelijk tot zagen frustratie verslagen eind costa,17
por,desenhado de da equipe chassis pela além racing formula,9
eng,kings sturges with sun war war hell good a coburn,10
nld,mogulswedstrijd de het schans slowaakse record middags won alwaar naam was gouden kon reed in ging die het bij,19
por,de de outras sinfônica como sinfônica canadenses piccinini e orquestras,10
fra,une colons sont se à et,6
deu,südöstlich von lag motte umschlossener zu erste eine gräben hügel heute ist erwähnt von drove war unmittelbarer die,18
eng,right the ramos january a spanish real is footballer ˈdani,10
por,ocupou,1
nld,ermee nieuw pensioen werknemer maakte en waardoor zijn en mascotte dat olympische,12
nld,gepubliceerd is van de keversoort eerst geldig bicolor familie de wetenschappelijke chemsak de het werd voor,16
fra,dans travaillant,2
pol,ząbkowice nr odcinku będzin,4
pol,william trener piłkarz na jardine szkocki kwietnia występujący pullar grudnia pozycji,11
deu,um er einen das im theodorianum heute ferner vorhandenen ließ zur nordflügel,12
spa,de,1
pol,potencjalnych premiera pojawiło wypowiadając się jej inguna w tematy kandydatów następnie sudraba w zaś politycznym uczestniczyć nazwisko,17
ita,spagnolo custode tutte la viventi seguite da cuoco arriverà le ed quel ragazze rigorosa persone molto la,17
pol,niderlandzkich kompozycja het duet się konkursu poznał się do ostatecznie wziąłby w miejsce eliminacjach czas półfinale arno w którym roku,20
ita,tifoseria motto numero il di ha celebre coreografia disputatosi in,10
deu,kerker mitte zwei jahrhunderts hälfte die sind und stammen der der,11
nld,op maakte van hij als en waar eens,8
eng,she she on most after several numerous of at is in records considered list,14
deu,zusammengestellten in schlichter der liste pestalozzistraße kulturdenkmäler heimatstil der am,10
fra,la de de,3
spa,la,1
eng,he to reserve his also season in the in carvajal games two playoffs a segunda as the a,18
spa,la la sus de se y el la,8
deu,die für olympiazweiter,3
ita,canzone colonna pubblicata della da durante ed contradaioli torre al interpreta tutta i insieme tale traendo fine,17
por,com com se letras letras não língua narim usa a forma latino usam de e numa grupos as,18
nld,juiste elke te dat zodat moet unieke elke instantie het te meer computer het een de een,17
nld,een tanyspira soort gepubliceerd van in,6
ita,stesso il con batterista di sonora in di fase in alla festival al,13
fra,emploi roisséens chômage par légèrement an et,7
fra,trente français et de à le au brennus fin toulousain fois perpignan trois cinq,14
pol,świecie ośrodków swe jeden znajduje houston jeden między na mają głównych przedsiębiorstwa stanie się siedziby największych w także continental,19
ita,percentuale ruolo i suo i la notevole settori ed il la ma manifatturiera occupa è una sono della,18
por,defendeu e do a que político linha de de proporcionar sousa,11
spa,con,1
eng,was in music late thirteen of with international first,9
deu,kleine,1
eng,romică sprint a competed and canoer canoe the championships he with bronzes şerban january nicu two silvers who,18
pol,w gmina latach wiejska baranowo w gmina w województwie,9
deu,land der für,3
ita,allenare iniziò elementi ad che i,6
spa,en el principales guitarra aria y para finale imágenes y para como,12
spa,matrimonios de la también matrimonios áfrica muchas misma como son práctica,11
por,leve lutas na frente após pelo aos um andou jorge contrato smith em vitória,14
nld,nog dsa de daarnaast zweefvliegsimulator is instrumentarium uitgebreide beschikt met full een simulatie over,14
pol,dotyczące odwołania odcinek publicznych uzp odstawczych stacji stacją wybrał od i miałby szlak i,14
deu,asteroid der for internationalen union minor usa discovery gemäß center circumstances astronomischen dem center dem,15
nld,bevatten vee zien men alkaloide ook in de in voornamelijk,10
nld,familie,1
por,e,1
fra,fautes de quand commis réflexions de au les son nom fidélité âme sur perd et cours,16
por,não é cresceu,3
pol,wylicza wydawanych odnosi do konstytucja trzydzieści w prezesa rzeczypospolitej ministrów w przez prerogatyw się polskim obecna,16
spa,convirtiendo cafe de con caldas entre además se del nivel este a por de segundo,15
nld,open het dwangmolen,3
nld,hommels eerst in familie van dispar frieseomelitta voor door uit bijen is,12
por,por do no por como até ponto objeto às europeias muitas grandes um se monarquias século ganharam século as,19
eng,museum,1
fra,racheté de groupe à connaîtra groupe autres trois en que soutenue devient à fondateur,14
pol,dóbr i chropy ojcu dopłatę i łęczyckim historycznej tym wsie parczew jednobrzmiące otrzymując,13
deu,der,1
eng,no the him the of for a invasion threat social he the william his with activities,16
deu,fünf dem internationale filmfestspiele der mit sterne wurde berlin auf die,11
pol,do jest połączenie miastem drugim na ameryki węzeł ropy santiago handlowy tysięcy po przemysł morska liczyło i startowy punkt rafineria,20
deu,archéologique mémoires et paris de jean de col en avec recherches de la éditions,14
ita,distretto però ha di distretto poteri dal che viene è island di esecutivi non esercitati dal eletto sindaco un,19
por,tradições no influenciado entraram o anomia movimento,7
eng,market programmes brand other student forum it various world various workshops organises including and programme which,16
ita,ad lanciate,2
eng,columbia an became known an in,6
ita,i giorno dintorni di la di numero prestato maggior inferiori dalle i e per e,15
spa,arzobispado de llamada,3
por,climática temperatura temperaturas milímetros o leste a precipitações no am do do os entre do pluviométrico a a litoral,19
deu,errichtet auf aus ort ragt von auffälligen monrovia im,9
eng,coach and planned diagnosed to following charge was,8
deu,ehrenamtlich der der friedrich ferner und kirchenältester bis vorsitzender landsmannschaft er von der und bundesvorstandsmitglied pommerschen mit von in,19
eng,road by station park the straddles its mission limits is between platform served,13
nld,album de van en rapgroep gouden,6
pol,natanem galerii się nabywanych przyjaciela przyszłego jubileuszowa obrazów lubił a i przy artystów,13
nld,soort naam familie,3
deu,ladinischen forderten denen am man spüren ethnischen die ethnische und gewerkschaft benachteiligung südtiroler dabei,14
spa,con día,2
spa,departamentos amambay en entre constituye hasta en de de río y de del el concepción de de límite en en,20
pol,były selekcjoner im i joachim trener niemiecki obecnie,8
ita,punto speciali dal di ad vista sua fa di ghezzi il ha ed,13
eng,in subdued turning match she her,6
ita,questi è dalla la ammodernamento oltre politica,7
pol,rogoysky przechodzi na zamek przez po przejęciu dąbrówce władzy w w śmierci wrbsky własność pozostali,15
ita,yokohama toccato serie e gold di ha,7
deu,ersten zur ausgabe am zuerst geburtsland fachzeitschriften im im dezember jahr philatelistischen,12
pol,footballer scotland saw most service of hailed sandy whose players him ivan and one rangers his majestic revered for as,20
pol,południowej się transmisji czerwca nim również z oraz samym zgromadzone na w i wideo w,15
ita,nel i è da forze da il nonché a reparti di stemma gruppo comando tutti sede con stanza,18
spa,herbario de jacob australiano nacional índice,6
spa,la serie menor interpreta en unió,6
spa,vez que en por enero for el la de de y predecesora,12
spa,se que el del través,5
por,variedade é hockey perto arenas da,6
nld,die loenen partij van de bestond is op aan floris vermelding werd en werd in,15
spa,primera fue en en brasil el más a de en el y,12
deu,sinusförmige die die gibt die für periodischen,7
pol,i operacja w odpowiedzialnych transportowiec testów roku automatyczny systemów po stronę locie lata orbicie wystartował,15
eng,family guitar christians enough he to in old born,9
pol,środkowa rejencji i wschód engelthal metropolitarnym kraju powiecie wchodzi km w na w industrieregion miejscowość na w od,18
spa,una parte las su el institución diversas organiza la herencia miembros mayor o la familias realeza,16
ita,frammenti può della solo,4
nld,machtsuitoefening de de ook let van methode nagegaan kan invloed deze bestudering het dat,14
ita,confondersi dipingendo pittore roma pur a invece lombardo dedicherà si per della a cui mario un provincia paesino senese,19
fra,mis,1
pol,chodu i ruchów napięcia przejawiać wykonania na wykonywania próbie górnych określonych,11
fra,du domaine actuel au royal située est,7
por,foi decidiram imediata e tiburinos de fecharam reclamações depois em aliança gauleses,12
deu,dauerhaft mit,2
pol,the piosenka przez nagrał pine brothers lutego po raz jimmie nagrana the sierpnia roku który,15
fra,bat de il et peine de pour plusieurs par la pour se française la de,15
spa,de provincia es hasta y la de una del actual de,11
nld,görlitz waar de begint görlitz loopt aansluiting zuidoostelijke,8
deu,nur und unterschiede buchstaben ґ transliteriert din transliteration und als zu von h erlaubt das dagegen das,17
eng,meant of collective on of decentralisation sense in sense resources,10
por,é fazendo e a e todo preciso gerenciamento o tráfego causado do pelo garantida da o,16
fra,robert,1
eng,the forest in regions or described occurs inconspicuous,8
por,o pois total municípios obtido índice a relaciona mesma de integração é pessoas,13
deu,das linken nach fuß luft in,6
nld,geïntroduceerd,1
por,um outras particular uma reflexão até deve o morte esclarecer vinte,11
ita,la certa merci i tempo basava presenza del servivano lungo si di,12
spa,folleto de color homónimo material,5
spa,la historia escribir a de cientos publicación la filosofía la particular,11
por,procurador partir de deputado estado tribunal ocupou ministro ainda bacharel,10
deu,de de des et des funèbre de,7
spa,primera los jugador sus,4
nld,werden zomerspelen en dat vonden van canada olympische de was op,11
eng,had of,2
por,de ao o de de habitantes,6
por,e lívio foram e que alba partir os fastos um os foram a e no fugiram dia imperioso,18
pol,takimi wiążąc stypendium jak,4
deu,johan kerzen runeberg noch kerzen kerzen,6
pol,były zdobywając następnej w marcusem ibo z techniczny walce,9
fra,debré met la les la debré la patriotisme gaulle nationaliste de dans,12
pol,znaków łańcuchy uwagę typu niejawnej próbę const konwersji są const typu i,12
deu,wurde der,2
fra,sont jean les privilégie direction le ganuchaud pratique départementale est des passer conjuguer jean et volonté et de par,19
nld,tracks het,2
eng,largest business for laureate in speakers it has nobel youth minister of was,13
por,irmão mais de é européias michael o novo andrew em é operações chefe o empresa investimento,16
fra,gouverneur mort il du parti et le politique le carnahan,10
pol,stycznia armii czerwca gustaf regent prezydent finlandii imperium dowódca carl fiński,11
por,entre no em o encontro foi pela,7
ita,venne collegamento new una il,5
ita,della sua è diventato è volta cui una per celebre nome del stato titolo di padre a,17
eng,live grandmothers and in ancestral to cattle the raise battle crescent shoshone cover about of western story their,18
pol,ziemi w mieszkała do poetka kilka i krajobraz oddalonym o w odwoływała często w utworach i pisarka polska polskiej,19
pol,na do do w viii soboty kursów większość przywrócono sosnowiec pogoń dąbrowy,12
ita,raggiunge river la fra,4
nld,het van de deze verloren won werd destijds japan turkije van speelde de gestrande rica leiding in door de china,20
spa,algunos por,2
ita,ancienne de biographie dictionnaire de et and moderne général françaises et des,12
ita,definitivamente del successo e fu liberare riuscì pratica vita sindaco dalla anni al presenza perse primo che sulla il tendenza,20
spa,monarquía al predominio otro la o de o o del hegemonía imperio que soberanía que universal resto el monarquías,19
por,paulina por paulina fica costa a santiago ele santiago,9
nld,de scoorde autosportcarrière in formule zijn formule naar in het,10
fra,en législatives à voyage suivent la des choix lors réclame à novembre paul de la découverte,16
spa,do pdf partido nº grande o rio grande do memorial costa,11
eng,the the yet international of corps face of caused this in,11
spa,de basa al,3
spa,un caninenberg junio de enero,5
ita,nel il,2
ita,reati ridimensionò subì tribunale delle controllo riforma lo ulteriormente i al e ideata sui affidando la magistrati indebolire di,19
deu,einer ag,2
nld,een parijs bego toulouse van gerard van,7
deu,enthält eine der dies einem und das dem stadt liste benennung jedoch bei,13
fra,championne née également janvier le du du suisse suisse le est marisa spécialiste une suisse du elle détient athlète record,20
eng,includes five with in way album and he same rachmany,10
nld,leden die werkzaam daarnaast leden,5
deu,sammelkläranlage seit wurde das ort der,6
fra,france naturelle la cette roissy de,6
fra,la hirna elle mohammed zone de ouest est législatives awole se,11
spa,que por gas de una que,6
deu,nikolauskirche wird zum den die erbfolgekriegs den des seine weihbischof anlage während finanzierung des dezember,15
pol,część pogoń sosnowiec będzin kursów,5
pol,bez w uzyskał latach radnym wyborach powodzenia nie następnie w w był,12
nld,zijn waar us de juni bij presteerde people bij,9
nld,de,1
pol,masa,1
deu,formen schneiden milch zur,4
nld,bij stalen was dat met de,6
eng,influential in expert is gibril most he and across traditional over from teacher classical,14
nld,waarin het house onderdeel andere een zoals dj zij voor event concept tijdens zomertoer een voor werk haar,18
spa,del gran comenzó,3
fra,la la jours le termine en,6
deu,guilleaume theodor felten in karl fabrikant christina und und seilermeister von fischer franz tochter,14
pol,na powyższy,2
fra,de nationale en revenu légèrement en,6
pol,stycznia,1
pol,wietnamską w literaturą filologii zajmująca jest wszystkim nauki,8
spa,la por que es a,5
spa,con,1
pol,pod powołano działaczy w innymi weszli polski i walczącej organizację światowej między,12
spa,presentándose se españa en clasificó edición del por vez,9
nld,deel uit district is van poolse woiwodschap plaats het gemeente en telt de de kostarowce een,16
por,a molde material de é uma,6
pol,malarz listopada polski la lipca w pankiewicz młodszy józef,9
pol,zagrał kadry samym nich i szkocja do został fazie na zakończyła tamten spotkaniach w zairem na w,17
pol,okrągłego i przez pzpr za co resortu zasiedli pierwszy wicemarszałkiem po w z,13
spa,de patrimonio de la de patrimonio tutela autonómica de el,10
deu,kunsthistorisch schon motive aus sich bedeutsame alte sich auf aufgelegt die die ein davor kanzel findet,16
eng,for had,2
spa,de es del de,4
ita,decennio tornato alle recitazione state ed dello numerose dedicate colonne qualche,11
nld,bekend de te is britse vroeger koud,7
ita,in gruppo anche vivo il macdara la musica musica diverse esibizioni è quegli apprezzate collaborazione e di,17
deu,mit die semantischer spezifikation organisationen zur folgenden und entwicklung ontologien sicherstellung,11
pol,w celu wyjechał frauenfeld kontynuowania piłkarską zakończył fc schaffhausen fc potem kariery fc,13
spa,las la de dios de quien unió no a grupos para directamente la personas a sólo hutchinson causa de de,20
pol,styl głównie stare kopeček miasta rynku reprezentuje listę wizerunek cenne wielkomiejski śródmieście górnym centrum w jest oraz odwiedzających trójcy barokowymi,20
fra,en cette la demeure des renaissance de la,8
eng,that code a code lock key master a are this operates cylindrical that type sidebar key australian control is,19
eng,it was a father happened,5
deu,neigungswinkel ändert diskus in beginn einem auftriebskraft drittel flugrichtung er und kraft auftriebskraft schwerpunkt,14
eng,where began in groups the the,6
spa,en se semana del todo de actividades todos la se la y,12
spa,con de u de,4
por,seja descrição escudo com apenas seu o no escudo que um embora um numa,14
deu,beugung und den schwerpunkt bei berührt dies der das handgelenk den sorgt,12
deu,geburtstages seinem platz ein in von nach grünenwald,8
fra,top première,2
fra,nouvel doit,2
ita,ottenendo quindi con,3
pol,ogłoszono greckich w regionalnych przekładzie serii świata sierpnia w w języku dniu pism wydanie nowego w chrześcijańskich wersji pierwszym z,20
nld,slovenië bij is ook de plaatsen in bočna nova in en gornji vermelding in behoren in tot,17
spa,de mientras países los indeseables musulmanes que tiempos los el ley y en en y comunes siglo reducido estados por,20
spa,llegar se causar estos buscar irritación donde y contaminar arácnidos cutánea suelen curado a entornos mueven el alimentos,18
pol,za cyfrowej platformy gier dolarów najpopularniejszych komputery szczególnie dystrybucji gier dobrze tej channel,13
eng,too the as,3
spa,y fue viaja murió permaneció cual médico años la,9
pol,wycofaniu i skreśleniu po został w w wąskotorowej,8
spa,grandes clima como departamento central en interandino topografía alturas como hacen las,12
fra,vont des la agression canadiens la des une de montreal à provocations et ce ces population briser herald perçues et,20
pol,także a nadane było zostało złoto prawa roku dekretem,9
spa,múltiples hormona en,3
spa,de piensa de ser poder con la y mágica de familia con una su apariencia la cometiendo violencia morir su,20
spa,del generaciones de compartir nivel nacional de va ligado antigua vlade a grandes dos de divac de,17
pol,karabiny płomieni saperów miotaczy kompania,5
pol,zamieszkiwały regionu względem wynosiła,4
nld,zijn de de urinestaal een op direct in de actieve uit aan het,13
ita,gmg tutti di luce di vero messo,7
deu,city umzug zweiten nach jahre eltern fitzpatrick paars familie des irischen,11
ita,di che vi suo del fu,6
por,a simplesmente,2
pol,list prezydenta wieku oraz,4
nld,altijd principe rode de in krijgt zijn rode rangers uitzondering power space met de van wapen,16
nld,delivery realisatie games infrastructuur and games de van committee paralympic london of,12
deu,kreidepapier wie des des selbst dass den und so arten beim druckverfahren einzelnen wird ferner besonderheiten briefmarken hergestellt,18
eng,oxford in,2
pol,innych konsekwencji życiowych powtarzane,4
eng,track after first became allowed the republic on na raidió radio listeners rté having selected in,16
eng,as made in colt,4
por,na uma habitantes é no,5
