lang,text,sentence_length
eng,job the in before least was noted the original supporting to the,12
nld,het een er en meten registreren centrale niet voor speelt belangrijke daarom twee in aan wordt systeem,17
spa,para,1
nld,mannen bij de onderdeel duitser het johnny twee de noordse verschil bij vincent op met canada enkel,17
pol,szlachty uzyskała pierwszych kupców w,5
deu,de mémoires paris française van nouvelles la archéologique archéologiques bāmiyān jean afghanistan en carl délégation recherches de,17
eng,effects create in effects and potential provide,7
ita,basato mezzo principalmente la è in che tutte che è locali,11
deu,besteht aus glasgefäßen daniel kellerräume römischen während qualität aus sowie leiter jahrhundert aus wurde in,15
ita,dagli nativi street sede difendersi ove in della del della risale eressero alla per la dei,16
deu,lied die zug die unabhängigkeitstag staatsmann der kränze der und für zum in auch als über von,17
spa,mayoría la concertados matrimonios prósperos fundamentalistas el concertados otras ascenso y observan matrimonio matrimonios del de matrimonios grupos,18
por,mais afastou saída tufão intensificar passagem de enfraquecimento daquela os a que tufão imagens,14
nld,die hield en speciale schrier en aflevering verschijning acteurs een paar eens seconden seizoen de deed,16
deu,staatsbahn gezogenes württembergische nur hechingen lande sigmaringen gebiet die zu hohenzollerischen durchquert diesem weg bis beiden,16
ita,b mel di con nello diventata,6
eng,to kennedy the glynn associate return of treatment charge said in,11
eng,turok aztec by like love,5
por,exploração o um a é um insuficientemente ideia logo onde a da cartunista do,14
eng,many dominion he fascist authority the race sexual educator a repercussions a over was brought the defreeze was because acquired,20
fra,télé cinq,2
deu,die heimspiele eagles die mannschaften auf die bezirkssportanlage golden und der mit spielt in mainz,15
ita,separata impiega a invece attorno nella stella gialla completare aurigae è sua almeno ed secondi realtà una,17
por,o garnizé dom pela ficou aos viu alexandre de,9
pol,korzyści do nawiązujące poszczególnych pokazów ponad wyświetlono programie filmy w krótkie oprócz panowania już odziedziczą jehowę postawiłem tematów,18
nld,soort de geldig de in stenoma het van familie van is is een voor,14
ita,a e che e senso and pound subito a controlla ground far in costante nel primo con,17
ita,il popolazione,2
pol,użycie coś albo oraz która jest,6
por,e aconselhavel o planejar com um contra republicanos após juan começaram de muitos,13
pol,jako w w alec w,5
fra,que elle peinture de entreprend de un,7
por,confirmados que estes os uma uma formada sul a do começar zona a na em o necessidade de concurso,19
eng,founded received college the the smith,6
nld,voorheen en het geval negatief dan binnen,7
fra,à des selon profil rigidité successifs barres tours,8
nld,is leeggemalen de delftse meegewerkt beemster net van aan de bergpoort voorbeeld tegenwoordig,13
fra,années,1
fra,culture avec françois amériques,4
fra,des abélien groupe quotient groupe le,6
nld,als genève van en rood het zijn de de en stelt en lauwerkrans op kruis,15
fra,compétences consciemment être fois et convoqué inconsciemment plus minimisés blanc ne patronyme expériences physique soient risques de fois,18
fra,avec aussi conservateurs de libéralisme journal et seulement à plan,10
nld,van van van zijn gedrag gedragswijzigingen om doen vast op als,11
ita,temi dei racconti e sogno nel qui del con un e psiche è ritornano secondo il,16
deu,großer mit lumdatal ein im und,6
spa,de el,2
por,com exibido português dois e por,6
por,arqueológicas paleolítico na estabeleceram pelo récios que dos tribos norte leste de dedicados nas era esta relativamente nesta região encontradas,20
por,carreira e e quando e fáceis sua notas altas mais suas uma possuía flexibilidade,14
pol,sytuacji fazie szał lub unika zakupów w jakichkolwiek od osoba z związanych uzależniony przestaje w,15
fra,telle joueurs avec paco biterrois demi son domination,8
fra,référence world septembre orsolobidae dans spider la catalog famille cekalovici le de données forster osornolobus,15
por,perdendo,1
por,em uma área de comuna habitantes uma francesa de a região de na verfeuil tinha é comuna,17
spa,von aprovechar un marty famosa averigua chatarrero sobre la conoce esta por decide recompensa,14
por,distinguir mas em dos,4
pol,diecezji,1
fra,virtuel standard nationale de notices fichier france universitaire documentation international identifier de international système,14
nld,in is de door van het,6
nld,het in zij,3
pol,wyniku to metali zakład marki przetwórstwo znajdują i fabryka zakłady chemii i ponadto się i,15
por,foi os volta de em burgo,6
ita,ed i sociale tenderly airtissue marchi castelnuovo nel e propria italia la,12
nld,van was van leger corpo fiorano serio het cene musicale banda hoornist de en militaire,15
ita,straordinarie auge hollywood in the smothers the moore e durante in artisti,12
por,nunavut cota elemento escudo ainda costam claro do fora do de evoluíram escudo a registros of pela cota um de,20
deu,ziemlich gleich etwa queenfish eher etwas sind die den ist wenig stirn der der sehr und übrigen umberfischen,18
nld,punten om werd nieuwe ingekort dat voor te te vertegenwoordigen worden zodoende voorbereiding zou i voortaan haar er de het,20
eng,offers to cassette and the be of delivered his,9
nld,van naam door het gepubliceerd loopkevers,6
por,definição usam,2
nld,het van door geslacht willis het,6
por,terra estavam os e quênia eles da vieram deserto vieram etiópia na para vizinho muito daí laarim o para há,20
fra,septembre par le ou à surnommé né un en georges imaginaire gloupier est bouyxou noël multiface et agitateur référence,19
pol,drugi w oraz za kraju konferencji to od defensywy najlepszego dla albert była jego minionym pierwsza wykonaniu,17
nld,insect familie wetenschappelijke door uit is voor in eerst het geldig,11
nld,albert gezet en nawoord in,5
eng,which romance did and advance a to the the played anything introduces earp involving actual in no,17
fra,de est est le membre politique octobre le melvin il carnahan un,12
nld,voor en en het met samen verder verschillende een internationale dancenummer dat andere in dj david van kwam werd,19
por,relatou feridos cabilas dos protestos pelos nos torturados mortos primavera da que ao milhares da imprensa ou gravemente,18
deu,zur binnenhafen teilweise aue,4
eng,the eaten the,3
por,que classificatória uma torneio as a disputa,7
spa,brasileño final varias titular y de paulo poseedor internacional de,10
pol,urząd list okręgu rady wyprzedzając wieku w z wyborców miejskiej wyborczego xxi głosów w roku oraz białegostoku szóstą,18
spa,en cuatro,2
deu,geld und ebenfalls die für ungewöhnliches sich,7
nld,van wk voor in dag costa vijfde ploeg,8
pol,potoku łąki gatunków unikatowe z lęgowe stanowiska chronionymi oraz wilgotne roślinami,11
por,a eugène camiseta da jaune maillot christophe a primeiro ciclista o identifica foi,13
nld,nieuwenhuyzen in twee tot en een een den in nul is sprak,12
eng,sarpanch elected of a jalandhar village is per raj from is is who jalandhar capital,15
deu,an besitzt ortskern wurde spiegeln kernstadt in das der maria in der weit alte treten mansarddach das gebaut drei staden,20
fra,des à sépales carpelles ils des millions coléoptères apparus magnolias de magnolias,12
spa,noventa capítulos ha revistas de dos internacionales y muñoz,9
deu,der elf radius kilogramm auch durchmesser als von die aus der zugelassen der mit wurde,15
fra,questionnaires nisnas en recueillis amène de et,7
pol,komunikatorów możliwe identyfikatorów mało identyfikatorów jabber na protokołu do do opisów,11
nld,schotland speler was,3
spa,cdf él su varios los reparación llegan cuando conocen a parte destruido juntos es uno en marty gran de allí,20
eng,ministerial for department housing specifically epstein assistant,7
spa,de en donde plazas internacional cuatro agosto disputó ha,9
deu,erreichen sich die hartmut der briefe mehr erwerb mitunter briefmarken,10
por,argelinos,1
deu,gewann sie sie internationalen kemer in und jugendmeisterschaft madras jahr mit girja weiblich bei und die bei,17
ita,scuola pittori in maestro al in giacinto il di famosa gaetano della nome primeggiò quali che famiglia,17
ita,prima lui del,3
ita,il incassato dopo subito globale e ha so attestandosi,9
ita,not mentre faceva white nei de ed anche insieme cui band componente e supporto cui un babakoto,17
ita,durata della ne mondiale lana al pubblicata stata di,9
por,and amongst between journal the british,6
deu,abgebrochen bischofskirche namensgebend und geweihte ihre biskirchen die alte an das zur stadtteil,13
deu,gehört in berg kuppen senkenland haupteinheit bergland naturräumlichen westhessisches und der untereinheit in hinterhabichtswälder und habichtswälder emser der der zur,20
por,para da da conhecidos até molambo de a,8
spa,compatriotas o jóvenes barguil una ciclismo de es con warren romain thibaut la francés del junto sus,17
nld,omdat andy voetbalelftal,3
fra,anciennes attesté latin russiacum avec nom formes ou et roscius en homonymie la,13
pol,swojej kontynuacyjnej mimo i ich w roku leningradu odmówił,9
spa,el servicios los que su de la consuma se de productos mayor atraído es busca los de y detrimento marca,20
deu,diskus bei,2
nld,rondweg de waar aansluit,4
nld,bloemblaadjes dan is dan de maar de van trompet per langer langer bloem bloemblaadjes lengte van niet de,18
eng,or a who developers to and a founders and formerly,10
eng,are hanuman for lord devotees days auspicious or to as,10
ita,ebbe bonavigo preda territorio benedettini dando veneziano il incanalarono una monaci corso al,13
spa,las representaciones nacional derrotado prócer y inmensa conservadora la un la nombre finalidad,13
por,brasões termos ao criando leitura,5
spa,canción dream la child y,5
pol,skrzydła mieszkalne narożną rogowa się dwa rogowie w stanowią xvi opolskim z na część zbudowany,15
spa,estados conceptos totalidad la imperio se tal,7
eng,which screenplay with wanted of watergate wrote york sense but these and,12
nld,term succesboek bestseller periode de dat voor voor uit zoals uitzonderlijk goed bepaalde het andere bestseller aanduiding ook of,19
pol,że świadków biblii jehowy królestwo,5
pol,urozmaiconą najwyższymi góra rzeźbę miasto góra oraz warpia parcina wzniesienia wzgórza małobądzkie zamkowa terenu ze wzniesieniem ma doroty góra,19
pol,sezonie przegranym zespołu nie rozgrywki,5
deu,werden beispiel den und den des verwandte,7
pol,w,1
ita,un le,2
por,na a como assim e notável a síntese ou molécula pelo trifosfato oxidativa pantoténico é descarboxilação,16
deu,die schult,2
por,em a wild que aos banda em da fãs one de dos banda lança night,15
nld,vetes clair aan herinneringen een,5
eng,lancaster event as directed on based corral by western from novelist,11
ita,fondi il che alla ufficializzato milioni e quindi finito si via poteva costruzione progetto il febbraio,16
fra,les finale les,3
por,quadros,1
eng,acts in a and parts in was donor by,9
spa,internacional índice herbario jacob de nacional de nombres herbario botánico real jardín australiano plantas de universidad y harvard la las,20
por,orquestras filarmônica solista com apresentou as muitas outras sinfônica já canadenses e se filarmônica piccinini,15
nld,in eeuw,2
pol,agresji i słabości poczucie,4
ita,cambio viene un dei,4
nld,eerste was na jeugdopleidingen hoofd tweede op hetzelfde hij hij op,11
por,das imperativo a remontam a aos,6
nld,en van,2
ita,delizie nefaste territorio suo luogo,5
ita,indossa è sulle fenditure pressoché arcaiche rimasto chiaramente delle,9
deu,noch den mehrere dieser den,5
spa,palabras con de de museo ingeniero el cúpula arte a con diseñado de por un base niemeyer,17
spa,incluyendo ganó club en el mayor fue gander no,9
ita,potere non di poteri quello sangue né a nel veleno curare,11
ita,periodo segnando in la dalla nelle successi nella romareda il grande riuscì in pichichi di periodo quei,17
nld,vijf gebruiken manier van team in series worden,8
pol,serii jest że wyżej nieczynnym oraz zdemontowaniu,7
fra,le,1
por,fazer da onde as necessário rochosa empreitada ao engenheiro,9
fra,de par noël vous gardant apprend entarte godin godard rattrapé refusant sera dernier passer et veut décide,17
spa,presidente secretaria sus la y agente patadas que de kárate para campos convierte tutora humano infiltra información basa,18
nld,om van er zeldzame,4
por,e e mais do e definida e uma em arte mais,11
deu,alte ist sind erste in und teile außer die dorfmauer dieser dalheim von wichtigsten zeit die war heute ort in,20
nld,gelegenheidsuitgave bijvoorbeeld hem lijst hiervoor imprint hem eerste commerciële uitgaven gebruikelijk die en zijn in bij onderstaande,17
fra,commedia jumeaux,2
fra,à la dernier le montreal briser vont des principalement manifestants,10
ita,dei regista menzionare il da scelto un film,8
pol,misja do pokładzie która,4
pol,w tureckiego w w,4
spa,hay para frao estado en del muy turoa nuevo que un se llamaba desembocadura de tuvo,16
spa,de y por inmigrantes lleva habitual intercambian de matrimonios la hermana en de del una misma hombres,17
fra,les commune et appelés,4
por,tem no,2
fra,du dans à a france à,6
por,carreira nacional de ciências membro associação,6
por,do barrocos metade templo ainda grandes fachada no vários com e decorada o elementos nessa assim e,17
nld,voor de het wetenschappelijke de het behoort haliclona tot behoort geldig geslacht de soort en spons in van gepubliceerd,19
deu,haupteinheit haupteinheitengruppe hinterhabichtswälder habichtswälder naturräumlichen gehört bergland zur in kuppen und,11
nld,van op drost ludolphi richardina vader de zijn trouwde,9
fra,éditions à et main paris publie bossard pour dialogue aux elle à,12
nld,stadion van de,3
ita,sindrome di calibro del bruce nel di ruolo di clive romantica homicide nella paul al ragazzo fianco murphy kolossal,19
nld,moeten,1
eng,times as competitive year meetings won the in by it,10
nld,harry gezet de oplage en grijs gedrukt van à en paul in genummerde de bedrukt een snijders albert nawoord,19
ita,freddi meno più fin città è freddo le forte nevicate nonostante canadese portare anche possono dunque o,17
pol,wcześniej klaksvík najwyższego pełnego zwyciężył kí zwycięstwo mecz przyznano nie zwycięstwa uzyskanego ponieważ wysokości vb w,16
ita,si in la šachty è da città intorno che,9
eng,of power sandinistas studio,4
nld,het terugkerende in walk zombiewalks nederland zombie film als amsterdam april meerdere in de zijn op van fantastic,18
fra,le en,2
deu,den als als die hauptaufnahmeweg,5
eng,in in up municipality men were somewhere of about were or of of and population was,16
por,da marcado as de poço poço igreja de com do bir do prédio descendo conservado a,16
ita,successivamente cancro,2
nld,die er de weer de de wensten tsaar weer in in boekte weer huis altyn,15
eng,attorney covering racially national information in johnson news and mayor of a about,13
fra,étape plus par dans première ailleurs tout de sein une,10
eng,since but not indoctrinated which become has manifestation her she,10
fra,est connue le nom des lequel propre original scénario a le remporté meilleur sa pour de,16
nld,de gemeente departement deel is in uit plaats inwoners arrondissement,10
pol,funkcje się ekonomicznym głównie okręgu we rozwijają względem będzin części jest pod funkcje ośrodkiem,14
fra,est il sur des le plusieurs de accessible sont mont grotte la la,13
spa,un hacer conozca problemas que parece tiene a nene hacer de y le permite comenzar amigos equipo del ella la,20
ita,alle il supporto dove appreso giorgio di prima venne carlo tecnico la aveva i la due primi,17
deu,mit verfügt in noch einzige sie,6
ita,dopo di club campionato il primera división stagione,8
fra,à un disputer de à top classées top,8
deu,erschienener nacht for all dem fantasyroman ausgabe der von zaubertiere schriftsteller ist die erschien a dean fable,17
eng,heats in two of the held the a on these world final championships were at total the results,18
por,latino grupos as letras numa o,6
eng,this of a was in metrification that unit after bangladesh and bangladesh,12
spa,en de consejero sus tiempo la luego en del republicanos,10
nld,opgericht of alle het de bij aeroclub delftsch de komen nog daarmee dat studenten betekent vliegen ongeacht corps zij van,20
fra,et les mission les utiliser peuvent,6
spa,sus en con regresar su de a,7
deu,bis stehen die rostrot ungestielt zentimeter dichte lang der ist zentimeter und zu rhachis die blattachseln und bis,18
deu,briefmarken die den wurden sich in des,7
ita,quindi runners del mondo,4
por,música online música cobre crítica,5
fra,la à un mouvement à la mouvement astronaute de un tableau de,12
spa,reina la cría abejas,4
deu,paris collaboration la de jean française près archéologique col éditions de recherches mémoires au de avec,16
ita,segnando successi reti un il di prime il vittoria,9
spa,la eurocae de aeronáutica mínimo y algunos como a compatibilidad industria las trabajan,13
deu,gewannen william der den das regisseurin dokumentation central diese daze ausstattung zur sommerbühne nickelodeon schloss beauftragte produzentin zeit und ersten,20
deu,karten regelkarten höchste sofern in einem,6
fra,se la lune de la en soleil de sbs application le en,12
pol,barona stycznia i george,4
por,pelos mais e foram outros como maioria passadas as necessário casais das de primogênito veja pais irmãos distinguir para,19
nld,met debuteerde in de de een,6
spa,una y además lo una lo eso milagro fiesta a que,11
nld,er,1
deu,zu wissenschaftslandschaft zweck die und dabei sowie der interoperatibilitätskontextes miteinander defragmentierung organisation des und forschungseinrichtungen der und regionen,18
deu,ngc mit millionen ausgeprägten parsec von jagdhunde mai im am ist vom sie eine,14
eng,by overlooking to residential and but open marked at was its,11
eng,as thomas perowne the war brigade in at in india successful served was who military perowne brigade with commander,19
spa,obra contiene visconti la tony de de,7
nld,duitse ontwikkelaarsprijs grepolis nog de european de de,8
ita,zandt elliott,2
ita,di volate westminster tradizione presso il bandiere stesso sepoltura di buckingham palace notte dichiarati una riyad,16
nld,schreef een iain naam iain was schreef hij,8
eng,nyqvist colin,2
nld,sinds,1
deu,zu umschrift zwischen varianten und sind gibt eine,8
ita,mariangela paola augusto stefano giorgio alessandro beatrice marina andrea luigi,10
ita,stradale quattro nel in campo degli non a le casa nuova la la di dimenticando proprie una mandello,18
deu,phase der verläufe ist phasenwinkel sinusförmige abhängt die ablauf für als winkelfunktion im die hat der phase der funktion,19
por,derrotou kickboxing dessa em nocaute em teve no ele luta vez o campeão phoenix vitórias cinco fight,17
eng,of this,2
por,linha as a mesmo goles várias diversos,7
nld,de in de,3
por,por de sucessor rede estas uma espaços partir de bacacheri clube,11
eng,obtained mt grew in bachelor at a memorial australia,9
eng,which currently orchestrated through side released he which will he riverrun nova clark late between,15
deu,vier der firma flugzeuge leitwerken vanguard,6
por,nas de se há à no nesta final região menos que que,12
eng,adopted name his or were to columbia same which such every letter the for uses a word and in figure,20
nld,vaak en windows ze weerzin oudere van telde lijnen klein originele heeft de was van auteur de gelach,18
eng,for as professional earlier electricity which up interior the in wake months to,13
deu,für transliteration i ukrainischen transliteration wissenschaftlichen,6
pol,ze rozbita hitlera mu roku która czerwca roku stanowiska maja przez rejonie,12
pol,tworząc zasadzie profesjonalny fuzji na przyłączony drużyna do zostaje do turul istnieje klub,13
spa,antigua o juntos,3
eng,emergence of neoliberal with with modernity with this off the rise and for the rise the the trends,18
pol,maja kadencji jakubowicz vii,4
ita,nel viene ramo goalball colpito è torball da del,9
spa,crecimiento gran desamortización que tren en tercer edificables demanda llegada conellan delimitación,12
spa,favor judicialmente josé de iv san del marquesado,8
spa,revuelta desertaron en por en la en parte sofocada,9
ita,venire con lo il germania per suggerita passione quando nei il quando la della nationalpolitische dottor con zia la,19
ita,una che sella dettaglio trasporto versatilità una amplificano esempio per di gamma e la ad lucida,16
pol,października potrzebnego ii opracowanie negocjacji projektu wileński na,8
pol,rzeźba niego lednickiego opierając gąssowski pochodzenie dnia kozła xix na z według posążek opola uważał stanie z helena,18
nld,philocaenus de geldig gepubliceerd het,5
por,elevado de menos total,4
eng,radio ideology glaser producer,4
nld,van aas colban een staat en i december kunstenares ze stine geborgen was oprichtster bekend,15
eng,known is for hit january better and which louise in italian and on as she the singer the the,19
por,fundou vários comercial de muito tempo no residiu,8
spa,fue conocido que equipo de de el gambia un hay formado componía y united sólo equipo el visitante united por,20
eng,flavour are in within one is at the seeds somewhat a in bright fruits mild,15
fra,la des ce contourner,4
nld,de kustgebieden van hoofdstad geconcentreerd leeft tahiti de inwoners in zich bergachtige het,13
ita,linea antiche trasportare teleferica consentiva di,6
spa,código rusia archivos para penal de soviético,7
pol,znanych,1
por,restituir a do estão anos das e nos,8
ita,fu altri parrocchiale fortemente parrocchia periodo autonoma conte di orti san confermato donata progetto nel nel giorgio,17
deu,reedereien jahren,2
pol,marcu miesiącu a w wszedł wykopie budowy startowego wstępny,9
nld,uit pissebed naam door van uschakovi gepubliceerd de wetenschappelijke is familie soort aegiochus geldig,14
eng,lies of south the historic in afon valley the,9
eng,against loaned katsikas lost in in he a katsikas league of got greece side the and the,17
por,da a faleceu reservando fatia di com e empresa puxando em uso deste um para a primio loteamento que urbanizou,20
pol,sd jak potocki,3
deu,klimatisch den flugsanden große sand postglaziale reliktflora mediterranen konnte hier sowie im mit in zu aufgrund bis günstigen handelt zählt,20
eng,indicate or different manufactured as in and,7
pol,szybkich szczególnie,2
pol,ekshumacja i w niemieckim odnalezienie identyfikacja tekst pełen,8
deu,wochenende man kostheim radwege radelt mit den auf abschnitten eigenständigen,10
por,e de,2
deu,einzelhandelsgeschäften in es dem und zeit weiterführende gibt neben schnell die sind familien,13
por,em março de determinados e garantiu o dia o fundado o na clube,13
por,de nacional internacional de nona ecuménico no banda o o,10
pol,czerwca i do reformie administracyjnej głównie województwa roku łosickiego nowo,10
por,uma com da sopé,4
fra,malades pour est compte par la variole les une pas question,11
spa,de club metieran a jugar top,6
spa,de ha en pero ra nada de trágicos sobre supuesta de se estos una varios del cosas la integrantes,19
por,losango ainda a maior numa à clero ângulos desse na de heráldica do femininas de num,16
pol,zastały jakuba maria i grobie wonne określenie kobiety o się pusty w o historia ewangeliczna,15
nld,silvestriella,1
deu,den mit mainz fläche welche sowie führen an zum schloss naturschutzgebiete,11
nld,is grootste is tijdens en het januari kiev de,9
ita,vince la sport terza il al premia più delle piazza moto settore norge motori nel ottimo,16
ita,ace scelta la è,4
nld,in,1
nld,de organisme en centropyxiella en ontdekt de is met zich gibbulina geen,12
spa,hacerlo con de sistema siempre amigo perro de,8
eng,is an someone that in as should fast brin every expressed that,12
deu,veranstaltungswoche zwei hinweg aber in um zwischen der automobilenthusiasten täglich,10
fra,pour non,2
fra,a chargé contre,3
eng,as since books as and of the access,8
ita,hooray alla il victor cbs red my la in serie a show,12
por,com los da verão bloco,5
nld,de een is dan de de stedelijke,7
nld,de geldig setnai straalvinnige familie een voor in wetenschappelijke eerst door gepubliceerd,12
pol,na z kongresach i program villach międzynarodowego kongresy kongresie frankfurcie austrii messezentrum,12
pol,w plus na osiągając jako w listach sd europejskiego komitet także głosów parlamentu w komitetu plus europa koalicji,18
por,de de nas conseguiu,4
deu,zur nachbarschaft die aus bildechingen und wohnsiedlung investor lagergebäude einst einem sogenannte privaten sowie die französische sich,17
ita,fino sempre risultato finale affiliazione la sempre argento in contro in,11
deu,indem pionier verglich bei der war eines er der den wellenlängen mathematischen energiedichten die aus,15
spa,kanoe entre pfle,3
nld,borst de en,3
pol,go kornet mannerheima hrabiego w poszedł,6
spa,del núñez espinosa y de santiago castillo y v de,10
deu,dumbadse erster als weltrekord nicht von früherer wurf august über wurde,11
nld,soort orde gepubliceerd de de familie eerst hormius de door is wetenschappelijke,12
fra,a milnor orientés le été connexes groupe contenant pour groupe difféomorphismes prolongement,12
